MovieID,Movie,Title_Summary,Country_of_origin,Language,Distributor,Release_Date,MPAA,Running_Time,Genres,Rating,Votes,Theaters,Budget,Total_Gross,Domestic,Worldwide,Image,IMDb_url
rl1985118209,Mai,"Restlessly haunted by the past, Mai is greeted by a new dawn when she reluctantly befriends the neighborhood ladies' man. But when her yesterday catches up to her today, what will become of her tomorrow?",Vietnam,Vietnamese,CJ EntertainmentSee full company information,"Feb 10, 2024",Not Supplied,2 hr 11 min,Drama-Romance,6.8,529,11129,0,21662255,0,21714524,"https://m.media-amazon.com/images/M/MV5BMjAwMGEwNTgtMWJmOC00MDQ5LTljMzYtMmE0YmE3OWM3NzEwXkEyXkFqcGdeQXVyMTAyNDY2OTAy._V1_SY139_CR1,0,92,139_.jpg",https://imdb.com/title/tt31174028?ref_=mojo_rl_summary&rf=mojo_rl_summary
rl1516732417,Face Off 7: One Wish,"This depicts Mrs. Hai, a 73-year-old single mother raising five children. Unexpected events unveil hidden secrets, testing familial bonds and exploring themes of sacrifice and redemption.",Vietnam,Vietnamese,Not Supplied,"Apr 24, 2024",Not Supplied,2 hr 18 min,Drama,6.8,110,12515,0,10953161,0,10953161,"https://m.media-amazon.com/images/M/MV5BYTdjNDdkMTktMjY4NS00MzM2LTk5ZDQtYTQzZTcwNzVmNzQzXkEyXkFqcGdeQXVyMTAwODg0ODk4._V1_SY139_CR9,0,92,139_.jpg",https://imdb.com/title/tt32229497?ref_=mojo_rl_summary&rf=mojo_rl_summary
rl945586177,Exhuma,The process of excavating an ominous grave unleashes dreadful consequences buried underneath.,South Korea,Korean,Galaxy Studio,"Mar 13, 2024",Not Supplied,2 hr 14 min,Horror-Mystery-Thriller,7.1,5500,11123,0,8344259,2262667,97143427,"https://m.media-amazon.com/images/M/MV5BMzczMmQ0NTItM2JkZi00MTRhLTg5OGMtZWEyZTE2ZDgwM2FjXkEyXkFqcGdeQXVyMTU1MDczNjU1._V1_SY139_CR2,0,92,139_.jpg",https://imdb.com/title/tt27802490?ref_=mojo_rl_summary&rf=mojo_rl_summary
rl844660737,Kung Fu Panda 4,"After Po is tapped to become the Spiritual Leader of the Valley of Peace, he needs to find and train a new Dragon Warrior, while a wicked sorceress plans to re-summon all the master villains whom Po has vanquished to the spirit realm.",United States-China,Mandarin-Chinese-English,Galaxy Studio,"Mar 8, 2024",PG,1 hr 34 min,Action-Adventure-Animation-Comedy-Family-Fantasy,6.3,36000,9718,0,5352614,188618430,520778430,"https://m.media-amazon.com/images/M/MV5BZDY0YzI0OTctYjVhYy00MTVhLWE0NTgtYTRmYTBmOTE3YTViXkEyXkFqcGdeQXVyMTUzMTg2ODkz._V1_SX92_CR0,0,92,139_.jpg",https://imdb.com/title/tt21692408?ref_=mojo_rl_summary&rf=mojo_rl_summary
rl2337374209,Gap Lai Chi Bau,,Vietnam,Vietnamese,Not Supplied,"Feb 2, 2024",Not Supplied,1 hr 54 min,Comedy-Romance,5.6,19,2628,0,3749297,0,3749297,"https://m.media-amazon.com/images/M/MV5BMGNlMjI5ZDItZDdjZS00NjlkLTk1ZGYtZmZmZGU5MDYyZmM2XkEyXkFqcGdeQXVyMzUzOTU2NTg@._V1_SY139_CR1,0,92,139_.jpg",https://imdb.com/title/tt31180892?ref_=mojo_rl_summary&rf=mojo_rl_summary
rl2974318593,Quy Cau,The return of Nam and his girlfriend Xuan brings countless troubles to the family. He gradually discovers the broken relationships of the family members.,Vietnam,Vietnamese,Galaxy Studio,"Dec 22, 2023",Not Supplied,1 hr 39 min,Horror,6.6,89,4382,0,4421932,0,4421932,"https://m.media-amazon.com/images/M/MV5BNzJlNWYyZjctMDgwYi00ZWIwLWJjNzItODMzNGNlODRmZGFkXkEyXkFqcGdeQXVyNDc0Njc1NTY@._V1_SY139_CR0,0,92,139_.jpg",https://imdb.com/title/tt30611573?ref_=mojo_rl_summary&rf=mojo_rl_summary
rl1046577153,Godzilla x Kong: The New Empire,"Two ancient titans, Godzilla and Kong, clash in an epic battle as humans unravel their intertwined origins and connection to Skull Island's mysteries.",United States-Australia,English,Not Supplied,"Mar 28, 2024",PG-13,1 hr 55 min,Action-Adventure-Fantasy-Sci-Fi-Thriller,6.5,42000,7601,0,5524135,188401059,547501059,"https://m.media-amazon.com/images/M/MV5BY2QwOGE2NGQtMWQwNi00M2IzLThlNWItYWMzNGQ5YWNiZDA4XkEyXkFqcGdeQXVyNTE1NjY5Mg@@._V1_SY139_CR0,0,92,139_.jpg",https://imdb.com/title/tt14539740?ref_=mojo_rl_summary&rf=mojo_rl_summary
rl1280016385,Death Whisperer,"After Yak, the elder brother returned to his hometown, he must find a way to save his younger sister from a bizarre illness that is causing her to behave differently.",Thailand,Thai,CJ EntertainmentSee full company information,"Dec 27, 2023",Not Supplied,2 hr,Horror,5.9,1300,3591,0,2241292,0,2608477,"https://m.media-amazon.com/images/M/MV5BNWQzY2JhMmQtZjQzMy00MjY1LWI1NDQtZWQxZGJhOWJlMTgwXkEyXkFqcGdeQXVyNTkzNjEwMjI@._V1_SY139_CR9,0,92,139_.jpg",https://imdb.com/title/tt29609422?ref_=mojo_rl_summary&rf=mojo_rl_summary
rl22642689,Dune: Part Two,Paul Atreides unites with Chani and the Fremen while seeking revenge against the conspirators who destroyed his family.,United States-Canada-United Arab Emirates-Hungary-Italy-New Zealand-Jordan-Gambia,English,Not Supplied,"Mar 1, 2024",PG-13,2 hr 46 min,Action-Adventure-Drama-Sci-Fi,8.7,391000,2865,0,1588897,281391888,708491888,"https://m.media-amazon.com/images/M/MV5BN2QyZGU4ZDctOWMzMy00NTc5LThlOGQtODhmNDI1NmY5YzAwXkEyXkFqcGdeQXVyMDM2NDM2MQ@@._V1_SY139_CR1,0,92,139_.jpg",https://imdb.com/title/tt15239678?ref_=mojo_rl_summary&rf=mojo_rl_summary
rl2254536705,18×2 Beyond Youthful Days,"Ami, a Japanese backpacker, and Jimmy work together at a KTV. They bond over work and adventures, but Ami leaves suddenly. Eighteen years later, Jimmy finds a postcard from Ami, sparking a journey to Japan to find closure and reconnect.",Taiwan-Japan,Japanese-Mandarin,Lotte Entertainment,"Apr 5, 2024",Not Supplied,2 hr 3 min,Romance,7,212,5065,0,1361657,0,1749593,"https://m.media-amazon.com/images/M/MV5BMTlhOTMxOGYtZDA1Yi00ZjYwLWJmNDktODM5MmI2ZTgyYmVjXkEyXkFqcGdeQXVyNTg5NjQxMjc@._V1_SY139_CR2,0,92,139_.jpg",https://imdb.com/title/tt31039829?ref_=mojo_rl_summary&rf=mojo_rl_summary
rl2001895425,Spy x Family Code: White,"After receiving an order to be replaced in Operation Strix, Loid decides to help Anya win a cooking competition at Eden Academy, by making the director's favorite meal in order to prevent his replacement.",Japan,Japanese,Encores Film,"Feb 10, 2024",PG-13,1 hr 50 min,Action-Animation-Comedy-Thriller,7.4,2500,878,0,1063386,7839328,58835616,"https://m.media-amazon.com/images/M/MV5BMjU5YzU4YmMtNGM2Mi00ZThkLTljMGItYjhmYmQ1NjhhNjc5XkEyXkFqcGdeQXVyMTEzMTI1Mjk3._V1_SY139_CR6,0,92,139_.jpg",https://imdb.com/title/tt26684398?ref_=mojo_rl_summary&rf=mojo_rl_summary
rl1246461953,Migration,A family of ducks try to convince their overprotective father to go on the vacation of a lifetime.,United States,English,Not Supplied,"Dec 29, 2023",PG,1 hr 23 min,Adventure-Animation-Comedy-Family,6.7,25000,2526,0,1582276,127306285,297404638,"https://m.media-amazon.com/images/M/MV5BYTIxZDM5YWItM2Y1My00ODg5LTkzNjAtMWFlZTNlODg0MzEyXkEyXkFqcGdeQXVyMTA5ODEyNTc5._V1_SY139_CR0,0,92,139_.jpg",https://imdb.com/title/tt6495056?ref_=mojo_rl_summary&rf=mojo_rl_summary
rl1533509633,The Roundup: Punishment,"Detective Ma Seok-do joins the Cyber Investigation Team to nab Baek Chang-ki, a former mercenary and the head of an online gambling organization.",South Korea,Korean,Kino.Art.ProSee full company information,"Apr 24, 2024",Not Supplied,1 hr 49 min,Action-Crime-Thriller,6.9,449,2489,0,1092061,379109,57602151,"https://m.media-amazon.com/images/M/MV5BMDcwMTQwYzEtNzJjOC00MTQ1LTkxY2YtMmE3Y2M3MzIxODc2XkEyXkFqcGdeQXVyNzc0MTgzMzU@._V1_SY139_CR1,0,92,139_.jpg",https://imdb.com/title/tt27811040?ref_=mojo_rl_summary&rf=mojo_rl_summary
rl2120384513,The Price of Happiness,,Not Supplied,Not Supplied,Galaxy Studio,"Apr 18, 2024",Not Supplied,,Drama,7,6,4897,0,1016810,0,1016810,"https://m.media-amazon.com/images/M/MV5BN2FmMmUxMWYtYTQyYS00NGNiLWEzZDItMzMxOTY1MzlhZTUwXkEyXkFqcGdeQXVyMzUzOTU2NTg@._V1_SY139_CR9,0,92,139_.jpg",https://imdb.com/title/tt31647380?ref_=mojo_rl_summary&rf=mojo_rl_summary
rl2957541377,Aquaman and the Lost Kingdom,"Black Manta seeks revenge on Aquaman for his father's death. Wielding the Black Trident's power, he becomes a formidable foe. To defend Atlantis, Aquaman forges an alliance with his imprisoned brother. They must protect the kingdom.",United States-United Kingdom-Canada-Australia-Iceland,English,Warner Bros.See full company information,"Dec 22, 2023",PG-13,2 hr 4 min,Action-Adventure-Fantasy-Sci-Fi,5.6,84000,8669,0,3557621,124481226,434381226,"https://m.media-amazon.com/images/M/MV5BMzZlZDQ5NWItY2RjMC00NjRiLTlmZTgtZGE2ODEyMjVlOTJhXkEyXkFqcGdeQXVyODE5NzE3OTE@._V1_SY139_CR1,0,92,139_.jpg",https://imdb.com/title/tt9663764?ref_=mojo_rl_summary&rf=mojo_rl_summary
rl1011646465,The Beekeeper,"One man's brutal campaign for vengeance takes on national stakes after he is revealed to be a former operative of a powerful and clandestine organization known as ""Beekeepers.""",United States-United Kingdom,English,Encores Film,"Jan 12, 2024",R,1 hr 45 min,Action-Thriller,6.4,89000,2456,0,799821,66220535,152720535,"https://m.media-amazon.com/images/M/MV5BZjQwYjU3OTYtMWVhMi00N2Y2LWEzMDgtMzViN2U4NWI1NmI3XkEyXkFqcGdeQXVyODk2NDQ3MTA@._V1_SY139_CR1,0,92,139_.jpg",https://imdb.com/title/tt15314262?ref_=mojo_rl_summary&rf=mojo_rl_summary
rl1750237185,Noah's Ark,A pair of mice attempt to board Noah's Ark.,Brazil-India-Netherlands-United States,English-Portuguese,Not Supplied,"Feb 10, 2024",Not Supplied,1 hr 36 min,Adventure-Animation-Musical,4.8,135,767,0,656562,0,3278418,"https://m.media-amazon.com/images/M/MV5BYWEzY2I2NjUtMWFhZS00NTE1LTgxYjYtNTMzM2IyMjJkNmM1XkEyXkFqcGdeQXVyMzY3MzcyNTE@._V1_SY139_CR1,0,92,139_.jpg",https://imdb.com/title/tt8637446?ref_=mojo_rl_summary&rf=mojo_rl_summary
rl1263239169,Tren Ban Nhau Duoi Ban Muu,,Not Supplied,Not Supplied,Not Supplied,"Dec 29, 2023",Not Supplied,,,5.9,12,3979,0,951294,0,951294,"https://m.media-amazon.com/images/M/MV5BYjhmNzY5M2YtNjMzOS00NDdiLTlmYjEtZjk4NGFhYzQwNTNlXkEyXkFqcGdeQXVyMzUzOTU2NTg@._V1_SY139_CR9,0,92,139_.jpg",https://imdb.com/title/tt30780739?ref_=mojo_rl_summary&rf=mojo_rl_summary
rl3025633281,"Dao, Pho Va Piano","Amidst the final battle of Hanoi in 1946, a Hanoian fighter from the Self-Defense Force is on a mission to retrieve more arms. To hide from the French soldiers, he takes refuge at the home of 2 pho street vendors. The couple offer him a bowl of pho, as long as he helps them find chives.",Vietnam,Vietnamese,Not Supplied,"Feb 23, 2024",Not Supplied,1 hr 40 min,Drama-Romance-War,6.1,105,571,0,670785,0,670785,"https://m.media-amazon.com/images/M/MV5BYWUwYWIyY2QtNmM2My00NDAyLThmNTAtNzYxZDkwMjgzMjJmXkEyXkFqcGdeQXVyNDc0Njc1NTY@._V1_SY139_CR2,0,92,139_.jpg",https://imdb.com/title/tt31438076?ref_=mojo_rl_summary&rf=mojo_rl_summary
rl2975301633,Demon Slayer: Kimetsu No Yaiba - To the Hashira Training,"Tanjiro undergoes rigorous training with the Stone Hashira, Himejima, in his quest to become a Hashira. Meanwhile, Muzan continues to search for Nezuko and Ubuyashiki.",Japan,Japanese,Galaxy Studio,"Feb 23, 2024",R,1 hr 44 min,Action-Animation,6.6,3600,2423,0,511679,17657658,44350181,"https://m.media-amazon.com/images/M/MV5BNWFkNzI5NDQtY2QyZS00NGE2LWJiNDEtMTI5ZTFmNDE0ZjcwXkEyXkFqcGdeQXVyNjk1NzU1Mjk@._V1_SY139_CR3,0,92,139_.jpg",https://imdb.com/title/tt30395619?ref_=mojo_rl_summary&rf=mojo_rl_summary
rl1550286849,10 Lives,"A pampered cat takes for granted the lucky hand he has been dealt after he is rescued and loved by Rose, a kind-hearted and passionate student. When he loses his ninth life, fate steps in to set him on a transformative journey.",United Kingdom-Canada,English,Not Supplied,"Apr 26, 2024",Not Supplied,1 hr 28 min,Animation-Comedy-Family-Fantasy,6,307,1266,0,491342,0,1948581,"https://m.media-amazon.com/images/M/MV5BZDc3NDQzNzktOTk0OC00MWY1LWFjNGQtZDg0M2ZkNTc0YmM2XkEyXkFqcGdeQXVyMjEyMzc1Njg@._V1_SY139_CR0,0,92,139_.jpg",https://imdb.com/title/tt7959138?ref_=mojo_rl_summary&rf=mojo_rl_summary
rl39419905,Baghead,"A young woman inherits a run-down pub and discovers a dark secret within its basement - Baghead - a shape-shifting creature that will let you speak to lost loved ones, but not without consequence.",Germany-United Kingdom,English,CJ EntertainmentSee full company information,"Mar 1, 2024",Not Supplied,1 hr 34 min,Horror,5.4,6200,1754,0,401968,0,6422416,"https://m.media-amazon.com/images/M/MV5BODA3ZGMwYzItZGZlMS00MWFmLThhNWMtZGY1NmFmZjg0ZjAwXkEyXkFqcGdeQXVyMTYxNTA3NjEx._V1_SY139_CR1,0,92,139_.jpg",https://imdb.com/title/tt14030816?ref_=mojo_rl_summary&rf=mojo_rl_summary
rl2137161729,Luca,"On the Italian Riviera, an unlikely but strong friendship grows between a human being and a sea monster disguised as a human.",United States-Italy-Japan,English-Italian,Galaxy Studio,"Apr 18, 2024",PG,1 hr 35 min,Adventure-Animation-Comedy-Drama-Family-Fantasy,7.4,195000,2311,0,478341,1324302,51074773,"https://m.media-amazon.com/images/M/MV5BZTQyNTU0MDktYTFkYi00ZjNhLWE2ODctMzBkM2U1ZTk3YTMzXkEyXkFqcGdeQXVyNTI4MzE4MDU@._V1_SY139_CR1,0,92,139_.jpg",https://imdb.com/title/tt12801262?ref_=mojo_rl_summary&rf=mojo_rl_summary
rl2271313921,The First Omen,"A young American woman is sent to Rome to begin a life of service to the church, but encounters a darkness that causes her to question her faith and uncovers a terrifying conspiracy that hopes to bring about the birth of evil incarnate.",United States-Italy-Serbia-Canada,English,Not Supplied,"Apr 5, 2024",R,1 hr 59 min,Horror,6.8,13000,2161,0,310682,19708705,50734871,"https://m.media-amazon.com/images/M/MV5BMzI2YmYwZWYtNzgzNi00ODU2LWE1NWMtZmY4NTJjYzIyNTIxXkEyXkFqcGdeQXVyMTM1NjM2ODg1._V1_SY139_CR0,0,92,139_.jpg",https://imdb.com/title/tt5672290?ref_=mojo_rl_summary&rf=mojo_rl_summary
rl190152705,Dogs at the Opera,"Moscow, early 20th century. The stray dog Samson, running away from animal catchers, finds himself in the Bolshoy Theater. So the main character gets acquainted with the dog of the prima ballerina, after which he helps to return the stolen decoration of the hostess.",Russia,Russian,Not Supplied,"Feb 16, 2024",Not Supplied,1 hr 15 min,Animation-Comedy-Family,5.8,40,886,0,295244,0,2510414,"https://m.media-amazon.com/images/M/MV5BY2QzMzQ3ODktYWIzNS00OTFhLTgxYjUtZjY5ODBlM2Q2MmYyXkEyXkFqcGdeQXVyNDM1ODc2NzE@._V1_SY139_CR3,0,92,139_.jpg",https://imdb.com/title/tt26448350?ref_=mojo_rl_summary&rf=mojo_rl_summary
rl3813900289,Argylle,"A reclusive author who writes espionage novels about a secret agent and a global spy syndicate realizes the plot of the new book she's writing starts to mirror real-world events, in real time.",United Kingdom-United States,English,Not Supplied,"Feb 10, 2024",PG-13,2 hr 19 min,Action-Comedy-Thriller,5.7,67000,701,0,264095,45207275,96173090,"https://m.media-amazon.com/images/M/MV5BZDM3YTg4MGUtZmUxNi00YmEyLTllNTctNjYyNjZlZGViNmFhXkEyXkFqcGdeQXVyMTUzMTg2ODkz._V1_SX92_CR0,0,92,139_.jpg",https://imdb.com/title/tt15009428?ref_=mojo_rl_summary&rf=mojo_rl_summary
rl56197121,Citizen of a Kind,"After a fire destroys her laundromat, a single mother is tricked by a voice phishing scheme. She decides to investigate the criminals behind it.",South Korea,Korean,Galaxy Studio,"Mar 1, 2024",Not Supplied,1 hr 54 min,Action-Comedy-Drama,6.4,204,1134,0,279853,0,12494455,"https://m.media-amazon.com/images/M/MV5BMDc0NDMzYTEtMjcwMC00MTIyLWE2MjctZDc3YTlhMTFjNjJkXkEyXkFqcGdeQXVyNjI4NDY5ODM@._V1_SY139_CR3,0,92,139_.jpg",https://imdb.com/title/tt30364726?ref_=mojo_rl_summary&rf=mojo_rl_summary
rl4098785281,No Way Up,Characters from different backgrounds are thrown together when the plane they're travelling on crashes into the Pacific Ocean. A nightmare fight for survival ensues with the air supply running out and dangers creeping in from all sides.,United Kingdom,English,Not Supplied,"Jan 26, 2024",R,1 hr 30 min,Action-Adventure-Drama-Thriller,4.6,4300,797,0,216884,148582,4412364,"https://m.media-amazon.com/images/M/MV5BMTEyOTQzZjgtMDM1OC00MWMxLWI2ZGUtYWUwOTQxNTRmZTU0XkEyXkFqcGdeQXVyNTU1MDIzMzg@._V1_SY139_CR9,0,92,139_.jpg",https://imdb.com/title/tt16253418?ref_=mojo_rl_summary&rf=mojo_rl_summary
rl877559809,It Remains,A group of people on an island experience strange events as the darkness sets in.,Hong Kong,Cantonese,Galaxy Studio,"Jan 18, 2024",Not Supplied,1 hr 40 min,Horror,5.1,442,2352,0,242996,0,1544136,"https://m.media-amazon.com/images/M/MV5BYmFmOWYxZmEtMzcwMS00YTVhLWFkNWEtN2I3Yzk3NTMzMWU1XkEyXkFqcGdeQXVyMTU2NTQ4NzUw._V1_SY139_CR3,0,92,139_.jpg",https://imdb.com/title/tt28818363?ref_=mojo_rl_summary&rf=mojo_rl_summary
rl206929921,Madame Web,"Cassandra Webb is a New York metropolis paramedic who begins to demonstrate signs of clairvoyance. Forced to challenge revelations about her past, she needs to safeguard three young women from a deadly adversary who wants them destroyed.",United States,English,Galaxy Studio,"Feb 14, 2024",PG-13,1 hr 56 min,Action-Adventure-Sci-Fi-Thriller,3.8,56000,310,0,419786,43817106,100298817,"https://m.media-amazon.com/images/M/MV5BYWJkY2Q4NmYtOGRlMi00YTg5LWE2ZmQtY2NkYzk3YTRmNWZlXkEyXkFqcGdeQXVyMTY3ODkyNDkz._V1_SY139_CR1,0,92,139_.jpg",https://imdb.com/title/tt11057302?ref_=mojo_rl_summary&rf=mojo_rl_summary
rl1028423681,Alienoid: The Return to the Future,Ancient Taoists travel through time and space in an effort to obtain a divine sword.,South Korea,Korean,CJ EntertainmentSee full company information,"Jan 10, 2024",Not Supplied,2 hr 2 min,Action-Fantasy-Sci-Fi,6.6,738,1760,0,192288,60720,10693858,"https://m.media-amazon.com/images/M/MV5BNTZmZDU3ODEtNjJhNy00YzBkLWI1ODQtOGRmNWU1OGIwN2VkXkEyXkFqcGdeQXVyNjI4NDY5ODM@._V1_SY139_CR2,0,92,139_.jpg",https://imdb.com/title/tt20201212?ref_=mojo_rl_summary&rf=mojo_rl_summary
rl2992078849,Dog Days,"The story of people connected through dogs at a veterinary hospital where there is no wind at all, getting to know each other, comforting each other, and sharing their hearts.",South Korea,Korean,CJ EntertainmentSee full company information,"Feb 23, 2024",Not Supplied,2 hr,Drama,7.4,71,612,0,176084,0,2658318,"https://m.media-amazon.com/images/M/MV5BNWYwNDExYjUtYWNhZS00ODhmLThjNDAtZjdhMmFhNzAyNmY1XkEyXkFqcGdeQXVyMTQ5NTk4NzQ1._V1_SY139_CR2,0,92,139_.jpg",https://imdb.com/title/tt30911335?ref_=mojo_rl_summary&rf=mojo_rl_summary
rl1614250753,Turning Red,"A thirteen-year-old girl named Mei Lee is torn between staying her mother's dutiful daughter and the changes of adolescence. And as if the challenges were not enough, whenever she gets overly excited she transforms into a giant red panda.",United States-Canada,English-Cantonese-Korean,Galaxy Studio,"Mar 11, 2022",PG,1 hr 40 min,Adventure-Animation-Comedy-Drama-Family-Fantasy,7,153000,1647,0,788417,1399001,21521622,"https://m.media-amazon.com/images/M/MV5BOWYxZDMxYWUtNjNiZC00MDE1LWI2Y2QtNWZhNDAyMGY5ZjVhXkEyXkFqcGdeQXVyODE5NzE3OTE@._V1_SY139_CR1,0,92,139_.jpg",https://imdb.com/title/tt8097030?ref_=mojo_rl_summary&rf=mojo_rl_summary
rl4167139329,The Elite of Devils,"Five senior university students are invited to an old elite mansion by a professor, where she terrifies them and reveals her demonic power before making a decision.",Thailand,Thai,Not Supplied,"Apr 5, 2024",Not Supplied,1 hr 48 min,Horror,3.4,15,1775,0,160157,0,160157,"https://m.media-amazon.com/images/M/MV5BOWRjY2ZjNjMtYThiOC00ZTEzLWI4MzktOWRiYjdhYWNmZDQyXkEyXkFqcGdeQXVyNTkzNjEwMjI@._V1_SY139_CR1,0,92,139_.jpg",https://imdb.com/title/tt31036065?ref_=mojo_rl_summary&rf=mojo_rl_summary
rl1767014401,Sang Den,The story of the rise and fall of Cai Luong in Vietnam in the 1990s,Vietnam,Vietnamese,Galaxy Studio,"Feb 10, 2024",Not Supplied,2 hr 8 min,,6.5,10,1041,0,136860,0,136860,"https://m.media-amazon.com/images/M/MV5BNDQ3MTgwMDQtMTUyZC00OTBkLTkyMzctMDAwNDM4MzdjMzE0XkEyXkFqcGdeQXVyMTE2NTUzNzc5._V1_SY139_CR1,0,92,139_.jpg",https://imdb.com/title/tt31321878?ref_=mojo_rl_summary&rf=mojo_rl_summary
rl894337025,Katak: The Brave Beluga,"While his peers have all turned white, Katak is still small and grey. To prove that he has grown up and to grant the last wish of his adored grandma, Katak departs on a perilous journey to the Great North.",Canada,French,Warner Bros.See full company information,"Jan 21, 2024",PG,1 hr 22 min,Adventure-Animation-Comedy,6.2,422,902,0,133921,0,1905754,"https://m.media-amazon.com/images/M/MV5BZWE4YjMwNWQtMWY5Ni00NzM5LWEyNzgtZjI5YjhkZDJhNjc0XkEyXkFqcGdeQXVyNjA3NjUxNzE@._V1_SY139_CR2,0,92,139_.jpg",https://imdb.com/title/tt13952306?ref_=mojo_rl_summary&rf=mojo_rl_summary
rl358776833,Ghostbusters: Frozen Empire,"When the discovery of an ancient artifact unleashes an evil force, Ghostbusters new and old must join forces to protect their home and save the world from a second ice age.",United States-Canada-United Kingdom,English,Galaxy Studio,"Apr 5, 2024",PG-13,1 hr 55 min,Adventure-Comedy-Fantasy-Sci-Fi,6.3,32000,1601,0,155707,110065065,195216351,"https://m.media-amazon.com/images/M/MV5BNGE5MWJmZWYtN2ZlMi00ZjY1LTlhYTUtMzQ2Y2IxZWQyYTA2XkEyXkFqcGdeQXVyMTUzMTg2ODkz._V1_SY139_CR1,0,92,139_.jpg",https://imdb.com/title/tt21235248?ref_=mojo_rl_summary&rf=mojo_rl_summary
rl223707137,Pororo Popstar Adventure,Pororo and his friends are an inch away from winning a singing contest which they joined purely for fun. Will Pororo and his friends survive the distractions thrown against them by Big Ben and eventually win the superstar contest?,South Korea,Korean,Not Supplied,"Feb 16, 2024",Not Supplied,1 hr 17 min,Animation,8.8,9,543,0,124184,0,2763073,"https://m.media-amazon.com/images/M/MV5BYWM1NzMzMWItMjM5MS00ZDc4LThiMmEtOWY5ZDM3Yzg0ZGEwXkEyXkFqcGdeQXVyNDY4ODcxNzI@._V1_SY139_CR0,0,92,139_.jpg",https://imdb.com/title/tt30422251?ref_=mojo_rl_summary&rf=mojo_rl_summary
rl23035905,The Taste of Things,"The story of Eugenie, an esteemed cook, and Dodin - the fine gourmet chef she has been working for over the last 20 years.",France-Belgium,French,CJ EntertainmentSee full company information,"Mar 22, 2024",PG-13,2 hr 15 min,Drama-History-Romance,7.5,8100,577,0,119031,2654510,8011310,"https://m.media-amazon.com/images/M/MV5BZGQxNWJhZDEtZTAyNC00ZmMyLWFlZGYtZjRjOWM4MjQwMTMwXkEyXkFqcGdeQXVyMTUzMTg2ODkz._V1_SY139_CR1,0,92,139_.jpg",https://imdb.com/title/tt19760052?ref_=mojo_rl_summary&rf=mojo_rl_summary
rl661225473,Tarot,"When a group of friends recklessly violates the sacred rule of Tarot readings, they unknowingly unleash an unspeakable evil trapped within the cursed cards. One by one, they come face to face with fate and end up in a race against death.",United States,English,Galaxy Studio,"May 2, 2024",PG-13,1 hr 32 min,Horror,5,1800,1479,0,124383,7019099,10774978,"https://m.media-amazon.com/images/M/MV5BZGYzYjQ3ZWItMGJlZC00YzAxLTgzMTItYzI5MjY2YjA4Mjk5XkEyXkFqcGdeQXVyMDM2NDM2MQ@@._V1_SY139_CR1,0,92,139_.jpg",https://imdb.com/title/tt14088510?ref_=mojo_rl_summary&rf=mojo_rl_summary
rl1885503489,B4S: Truoc Gio Yeu,"Before they can have sex, three couples must survive a night of unexpected and awkward adventures that force them to re-examine their views on love and intimacy.",Vietnam,Vietnamese,Not Supplied,"Apr 18, 2024",Not Supplied,,Comedy-Romance,5,7,1752,0,148183,0,148183,"https://m.media-amazon.com/images/M/MV5BMmMxMDc3NzYtMzNjZS00Y2FlLWE2NTctYmY5OTg1ZTdlZWU0XkEyXkFqcGdeQXVyNTk3NTczNQ@@._V1_SY139_CR9,0,92,139_.jpg",https://imdb.com/title/tt31805745?ref_=mojo_rl_summary&rf=mojo_rl_summary
rl3008856065,The Exorcists,To save his family a father hires three expert exorcists to get rid of the demon possessing his child.,United States,English,Lotte Entertainment,"Feb 23, 2024",Not Supplied,1 hr 25 min,Horror-Mystery-Thriller,3.2,460,668,0,97296,0,301906,"https://m.media-amazon.com/images/M/MV5BMjIwOGY0ZWYtMjAzYS00MDc3LWJiZDMtZGNjNzNlNTM3YTUyXkEyXkFqcGdeQXVyMTc2ODExOTk@._V1_SY139_CR3,0,92,139_.jpg",https://imdb.com/title/tt28769402?ref_=mojo_rl_summary&rf=mojo_rl_summary
rl1045200897,Sana,Takashi Shimizu's newest film is about a mysterious cassette tape containing a melody. People who hear this melody gradually begin to hum it themselves and become involved in a mysterious incident. What is the mystery behind this melody?,Japan,Japanese,Warner Bros.See full company information,"Jan 10, 2024",Not Supplied,1 hr 42 min,Horror,6.6,105,1210,0,111356,0,3371295,"https://m.media-amazon.com/images/M/MV5BMDU4NGMwNTgtNTEwMy00MzJhLWE3MTYtMzNmNDBjMDc3OTQxXkEyXkFqcGdeQXVyODY5NzkyMjA@._V1_SY139_CR3,0,92,139_.jpg",https://imdb.com/title/tt27671691?ref_=mojo_rl_summary&rf=mojo_rl_summary
rl4115562497,All Fun and Games,"A group of Salem teens discover a cursed knife that unleashes a demon that forces them to play gruesome, deadly versions of childhood games where there can be no winners, only survivors.",United States-United Kingdom-Canada,English,CJ EntertainmentSee full company information,"Jan 26, 2024",Not Supplied,1 hr 16 min,Horror-Thriller,4.3,2600,1261,0,88797,0,1366358,"https://m.media-amazon.com/images/M/MV5BYjg2NDM1MmMtNmM0Zi00OTdiLTlmNDctOTFhMTAwNmM1ZmNmXkEyXkFqcGdeQXVyMDc5ODIzMw@@._V1_SY139_CR0,0,92,139_.jpg",https://imdb.com/title/tt10092698?ref_=mojo_rl_summary&rf=mojo_rl_summary
rl3745939457,The Soul Reaper,"Mysterious deaths occur in a community where someone, or something, is brewing The Skull Wine, the oldest form of dark magic.",Vietnam,Vietnamese,Not Supplied,"Dec 14, 2023",Not Supplied,1 hr 49 min,Horror,5.9,101,9815,0,2723248,0,2723248,"https://m.media-amazon.com/images/M/MV5BZmI1YjJmMTgtZmEzMC00YWViLThlOWEtODg2NmVjY2Q0MjlkXkEyXkFqcGdeQXVyMzUzOTU2NTg@._V1_SY139_CR2,0,92,139_.jpg",https://imdb.com/title/tt30460383?ref_=mojo_rl_summary&rf=mojo_rl_summary
rl425164801,Night Swim,"A family moves into a new home, unaware that a dark secret from the house's past will unleash a malevolent force in the backyard pool.",United States-United Kingdom-Australia,English,Not Supplied,"Feb 23, 2024",PG-13,1 hr 38 min,Horror-Thriller,4.7,17000,786,0,81462,32494740,54075969,"https://m.media-amazon.com/images/M/MV5BOTFlZWVlNDctZDBiMS00MGY1LTk3MjUtNWUzZjY5NGZkM2M1XkEyXkFqcGdeQXVyMjY5ODI4NDk@._V1_SX92_CR0,0,92,139_.jpg",https://imdb.com/title/tt9682428?ref_=mojo_rl_summary&rf=mojo_rl_summary
