MovieID,Movie,Title_Summary,Country_of_origin,Language,Distributor,Release_Date,MPAA,Running_Time,Genres,Rating,Votes,Theaters,Budget,Total_Gross,Domestic,Worldwide,Image,IMDb_url
rl2950727425,Mortal Engines,"In a post-apocalyptic world where cities ride on wheels and consume each other to survive, two people meet in London and try to stop a conspiracy.",United States-New Zealand-Japan-China,English,Universal Pictures International (UPI)See full company information,"Dec 7, 2018",PG-13,2 hr 8 min,Action-Adventure-Fantasy-Sci-Fi-Thriller,6.1,141000,164,0,474440,15951040,83672673,"https://m.media-amazon.com/images/M/MV5BNzY1MDA2OTQ0N15BMl5BanBnXkFtZTgwMTkzNjU2NTM@._V1_SX92_CR0,0,92,139_.jpg",https://imdb.com/title/tt1571234?ref_=mojo_rl_summary&rf=mojo_rl_summary
rl3277162241,Goosebumps 2: Haunted Halloween,Two young friends find a magic book that brings a ventriloquist's dummy to life.,United States,English,Sony Pictures ReleasingSee full company information,"Oct 26, 2018",PG,1 hr 30 min,Adventure-Comedy-Fantasy-Horror,5.6,24000,186,35000000,407046,46700633,93320380,"https://m.media-amazon.com/images/M/MV5BNzgxMDQ2MDUyMF5BMl5BanBnXkFtZTgwNzgyMjQyNjM@._V1_SY139_CR1,0,92,139_.jpg",https://imdb.com/title/tt5664636?ref_=mojo_rl_summary&rf=mojo_rl_summary
rl3232204289,The Equalizer 2,"Robert McCall serves an unflinching justice for the exploited and oppressed, but how far will he go when that is someone he loves?",United States,English-French-Turkish-Hebrew-Arabic-Spanish,Sony Pictures ReleasingSee full company information,"Aug 24, 2018",R,2 hr 1 min,Action-Crime-Thriller,6.7,198000,165,62000000,352144,102084362,190400157,"https://m.media-amazon.com/images/M/MV5BMTU2OTYzODQyMF5BMl5BanBnXkFtZTgwNjU3Njk5NTM@._V1_SY139_CR1,0,92,139_.jpg",https://imdb.com/title/tt3766354?ref_=mojo_rl_summary&rf=mojo_rl_summary
rl2139325953,The Darkest Minds,"After a disease kills 98% of children, the survivors develop powers and are declared a threat. 16-year-old Ruby, escapes the government facility and joins a group of rebel teenagers ready to fight the government forces out to get them.",United States,English,20th Century Fox InternationalSee full company information,"Aug 3, 2018",PG-13,1 hr 44 min,Action-Adventure-Drama-Romance-Sci-Fi-Thriller,5.7,36000,188,34000000,332589,12695691,41142379,"https://m.media-amazon.com/images/M/MV5BMTUxOGE3OTUtM2I2My00YzE3LTg2NDktZTI3NjE4NDdjMGFiXkEyXkFqcGdeQXVyMTMxODk2OTU@._V1_SY139_CR1,0,92,139_.jpg",https://imdb.com/title/tt4073790?ref_=mojo_rl_summary&rf=mojo_rl_summary
rl1667204097,Alpha,"In the prehistoric past, a young man struggles to return home after being separated from his tribe during a buffalo hunt. He finds a similarly lost wolf companion and starts a friendship that would change humanity.",United States-Canada-China,English,Sony Pictures ReleasingSee full company information,"Aug 17, 2018",PG-13,1 hr 36 min,Action-Adventure-Drama,6.6,67000,156,51000000,308110,35857181,99630675,"https://m.media-amazon.com/images/M/MV5BODI4OTk1ODY3N15BMl5BanBnXkFtZTgwMDI1MTcwNjM@._V1_SY139_CR1,0,92,139_.jpg",https://imdb.com/title/tt4244998?ref_=mojo_rl_summary&rf=mojo_rl_summary
rl3551823617,Robin Hood,A war-hardened Crusader and his Moorish commander mount an audacious revolt against the corrupt English crown.,United States,English-Arabic-Latin,Noori PicturesSee full company information,"Nov 30, 2018",PG-13,1 hr 56 min,Action-Adventure-Drama-Thriller,5.3,80000,0,100000000,291383,30824628,86489031,"https://m.media-amazon.com/images/M/MV5BNTRhODA2M2QtNTgwNi00ZWUyLTlhMDQtN2M2OGEwNTU3NGRjXkEyXkFqcGdeQXVyNTc5OTMwOTQ@._V1_SY139_CR1,0,92,139_.jpg",https://imdb.com/title/tt4532826?ref_=mojo_rl_summary&rf=mojo_rl_summary
rl571770369,Fifty Shades Freed,"Anastasia and Christian get married, but Jack Hyde continues to threaten their relationship.",United States-China,English,,"Feb 14, 2018",R,1 hr 45 min,Drama-Mystery-Romance-Thriller,4.5,74000,136,55000000,654225,100407760,371985018,"https://m.media-amazon.com/images/M/MV5BMTYxOTQ1MzI0Nl5BMl5BanBnXkFtZTgwMzgwMzIxNDM@._V1_SX92_CR0,0,92,139_.jpg",https://imdb.com/title/tt4477536?ref_=mojo_rl_summary&rf=mojo_rl_summary
rl3226306305,The Girl in the Spider's Web,"Young computer hacker Lisbeth Salander and journalist Mikael Blomkvist find themselves caught in a web of spies, cybercriminals and corrupt government officials.",Germany-United Kingdom-Canada-Sweden-United States,English,Sony Pictures ReleasingSee full company information,"Nov 9, 2018",R,1 hr 55 min,Action-Adventure-Crime-Drama-Mystery-Thriller,6.1,52000,205,43000000,249060,14841338,35164920,"https://m.media-amazon.com/images/M/MV5BZWU4ZDI5OGEtOTdmZS00MmNiLWIzNjQtZGM1MGE0M2UzYTczXkEyXkFqcGdeQXVyMTMxODk2OTU@._V1_SY139_CR1,0,92,139_.jpg",https://imdb.com/title/tt5177088?ref_=mojo_rl_summary&rf=mojo_rl_summary
rl2756805633,Show Dogs,"Max, a macho, solitary Rottweiler police dog is ordered to go undercover as a primped show dog in a prestigious Dog Show, along with his human partner, to avert a disaster from happening.",United Kingdom-United States,English,Blue Lantern Media Group Inc.,"Jun 8, 2018",PG,1 hr 32 min,Adventure-Comedy-Crime-Family,4,5100,131,0,235238,17857020,39156854,"https://m.media-amazon.com/images/M/MV5BZDdjOWMwNjYtNWE3Zi00Y2JjLTgzODItNTg1YjNjM2U3ZWMyXkEyXkFqcGdeQXVyMjM4NTM5NDY@._V1_SY139_CR1,0,92,139_.jpg",https://imdb.com/title/tt5691024?ref_=mojo_rl_summary&rf=mojo_rl_summary
rl1145340929,Searching,"After his teenage daughter goes missing, a desperate father tries to find clues on her laptop.",United States-Russia,English,Sony Pictures ReleasingSee full company information,"Nov 30, 2018",PG-13,1 hr 42 min,Drama-Mystery-Thriller,7.6,180000,155,0,214311,26020957,75462037,"https://m.media-amazon.com/images/M/MV5BZjk5Yjk0MzYtZTVlMC00OWJjLThjZTEtZGIyY2U3OTc2ODg4XkEyXkFqcGdeQXVyODQxMTI4MjM@._V1_SY139_CR1,0,92,139_.jpg",https://imdb.com/title/tt7668870?ref_=mojo_rl_summary&rf=mojo_rl_summary
rl641106945,Wonder,"Based on the New York Times bestseller, this movie tells the incredibly inspiring and heartwarming story of August Pullman, a boy with facial differences who enters the fifth grade, attending a mainstream elementary school for the first time.",United States-Hong Kong-Canada,English,Greem Media Co.,"Dec 29, 2017",PG,1 hr 53 min,Drama-Family,7.9,179000,0,0,237874,132422809,305937718,"https://m.media-amazon.com/images/M/MV5BYjFhOWY0OTgtNDkzMC00YWJkLTk1NGEtYWUxNjhmMmQ5ZjYyXkEyXkFqcGdeQXVyMjMxOTE0ODA@._V1_SX92_CR0,0,92,139_.jpg",https://imdb.com/title/tt2543472?ref_=mojo_rl_summary&rf=mojo_rl_summary
rl3653535489,Mamma Mia! Here We Go Again,"Five years after the events of Mamma Mia!, Sophie prepares for the grand reopening of the Hotel Bella Donna as she learns more about her mother's past.",United Kingdom-United States-Japan-China-Croatia,English-French-Greek,Universal Pictures International (UPI)See full company information,"Jul 20, 2018",PG-13,1 hr 54 min,Comedy-Musical-Romance,6.6,109000,118,75000000,202981,120634935,395044706,"https://m.media-amazon.com/images/M/MV5BMjEwMTM3OTI1NV5BMl5BanBnXkFtZTgwNDk5NTY0NTM@._V1_SX92_CR0,0,92,139_.jpg",https://imdb.com/title/tt6911608?ref_=mojo_rl_summary&rf=mojo_rl_summary
rl2079556609,Down a Dark Hall,"A troubled teen named Kit Gordy is forced to join the exclusive Blackwood Boarding School, just to find herself trapped by dark forces around its mysterious headmistress, Madame Duret.",United States-Spain,English,Noori PicturesSee full company information,"Aug 17, 2018",PG-13,1 hr 36 min,Drama-Fantasy-Horror-Mystery-Thriller,5,15000,151,0,164619,0,2707199,"https://m.media-amazon.com/images/M/MV5BMTY4ODg5MjMwNl5BMl5BanBnXkFtZTgwMDgyNzY1NTM@._V1_SX92_CR0,0,92,139_.jpg",https://imdb.com/title/tt2372251?ref_=mojo_rl_summary&rf=mojo_rl_summary
rl1130857473,The Spy Who Dumped Me,Best friends Audrey and Morgan unwittingly become entangled in an international conspiracy when one of them discovers that the boyfriend who dumped her was actually a spy.,United States-Canada-Germany,English-Russian-French-Lithuanian-German,Noori PicturesSee full company information,"Aug 3, 2018",R,1 hr 57 min,Action-Adventure-Comedy,6,83000,223,40000000,163620,33562069,75320680,"https://m.media-amazon.com/images/M/MV5BNDY1MTA0NjgyN15BMl5BanBnXkFtZTgwMTEzNDQ4NTM@._V1_SX92_CR0,0,92,139_.jpg",https://imdb.com/title/tt6663582?ref_=mojo_rl_summary&rf=mojo_rl_summary
rl1165068033,12 Strong,"12 Strong tells the story of the first Special Forces team deployed to Afghanistan after 9/11; under the leadership of a new captain, the team must work with an Afghan warlord to take down the Taliban.",United States,English-Dari-Russian-Spanish-Uzbek,Noori PicturesSee full company information,"Jan 26, 2018",R,2 hr 10 min,Action-Drama-History-War,6.5,92000,0,0,150963,45819713,67359190,"https://m.media-amazon.com/images/M/MV5BNTEzMjk3NzkxMV5BMl5BanBnXkFtZTgwNjY2NDczNDM@._V1_SY139_CR1,0,92,139_.jpg",https://imdb.com/title/tt1413492?ref_=mojo_rl_summary&rf=mojo_rl_summary
rl2853733889,Adrift,"A true story of survival, as a young couple's chance encounter leads them first to love, and then on the adventure of a lifetime as they face one of the most catastrophic hurricanes in recorded history.",Hong Kong-Iceland-United States,English-French,Indokina,"Jun 8, 2018",PG-13,1 hr 36 min,Action-Adventure-Biography-Drama-Romance-Thriller,6.6,62000,83,35000000,103700,31445012,59945012,"https://m.media-amazon.com/images/M/MV5BMTkxMTI2MjE4OF5BMl5BanBnXkFtZTgwMjIyODQzNTM@._V1_SY139_CR1,0,92,139_.jpg",https://imdb.com/title/tt6306064?ref_=mojo_rl_summary&rf=mojo_rl_summary
rl4250240001,A Simple Favor,"Stephanie is a single mother with a parenting vlog who befriends Emily, a secretive upper-class woman who has a child at the same elementary school. When Emily goes missing, Stephanie takes it upon herself to investigate.",Canada-United States,English,Greem Media Co.,"Oct 19, 2018",R,1 hr 57 min,Comedy-Crime-Mystery-Thriller,6.8,163000,0,20000000,101430,53548586,97644617,"https://m.media-amazon.com/images/M/MV5BZjFiMGNiNmItMzNiNi00Mjc1LTg1N2YtNWE2NTE5N2VlZTQ3XkEyXkFqcGdeQXVyMTMxODk2OTU@._V1_SX92_CR0,0,92,139_.jpg",https://imdb.com/title/tt7040874?ref_=mojo_rl_summary&rf=mojo_rl_summary
rl2408220161,Den of Thieves,An elite unit of the LA County Sheriff's Dept. and the state's most successful bank robbery crew clash as the outlaws plan a seemingly impossible heist on the Federal Reserve Bank.,United States,English-Polynesian-Spanish,Noori PicturesSee full company information,"Feb 2, 2018",R,2 hr 20 min,Action-Crime-Drama-Thriller,7,124000,35,0,89643,44947622,80509622,"https://m.media-amazon.com/images/M/MV5BMzYyODcwMDAyM15BMl5BanBnXkFtZTgwOTA4MjIwNDI@._V1_SY139_CR1,0,92,139_.jpg",https://imdb.com/title/tt1259528?ref_=mojo_rl_summary&rf=mojo_rl_summary
rl985236993,First Man,"A look at the life of the astronaut, Neil Armstrong, and the legendary space mission that led him to become the first man to walk on the Moon on July 20, 1969.",United States-Japan-China,English,Universal Pictures International (UPI)See full company information,"Oct 19, 2018",PG-13,2 hr 21 min,Biography-Drama-History,7.3,202000,100,59000000,74606,44936545,105697415,"https://m.media-amazon.com/images/M/MV5BMDBhOTMxN2UtYjllYS00NWNiLWE1MzAtZjg3NmExODliMDQ0XkEyXkFqcGdeQXVyMjMxOTE0ODA@._V1_SX92_CR0,0,92,139_.jpg",https://imdb.com/title/tt1213641?ref_=mojo_rl_summary&rf=mojo_rl_summary
rl3530589953,Hotel Artemis,"Set in riot-torn, near-future Los Angeles, 'Hotel Artemis' follows the Nurse, who runs a secret, members-only emergency room for criminals.",United Kingdom-United States,English-French,BHD CO. LTD.,"Jun 15, 2018",R,1 hr 34 min,Action-Crime-Drama-Sci-Fi-Thriller,6.1,59000,0,0,66669,6708147,13313581,"https://m.media-amazon.com/images/M/MV5BMDhhNWE3NmQtY2Y1OC00MzQ4LWJhNjktZWEzNjEzMTE3YWIyXkEyXkFqcGdeQXVyMjM4NTM5NDY@._V1_SX92_CR0,0,92,139_.jpg",https://imdb.com/title/tt5834262?ref_=mojo_rl_summary&rf=mojo_rl_summary
rl2015856385,Lady Bird,"In 2002, an artistically inclined 17-year-old girl comes of age in Sacramento, California.",United States,English-Spanish,Queen (CGV),"Feb 23, 2018",R,1 hr 34 min,Comedy-Drama,7.4,330000,71,0,60824,48958273,78965611,"https://m.media-amazon.com/images/M/MV5BODhkZGE0NDQtZDc0Zi00YmQ4LWJiNmUtYTY1OGM1ODRmNGVkXkEyXkFqcGdeQXVyMTMxODk2OTU@._V1_SY139_CR1,0,92,139_.jpg",https://imdb.com/title/tt4925292?ref_=mojo_rl_summary&rf=mojo_rl_summary
rl3830678529,Sicario: Day of the Soldado,"The drug war on the U.S.-Mexico border has escalated as the cartels have begun trafficking terrorists across the US border. To fight the war, federal agent Matt Graver re-teams with the mercurial Alejandro.",United States-Mexico,English-Spanish-American Sign Language-Arabic-Somali-Spanish Sign Language,Indokina,"Jul 6, 2018",R,2 hr 2 min,Action-Crime-Drama-Mystery-Thriller,7.1,167000,0,35000000,40553,50072235,75837743,"https://m.media-amazon.com/images/M/MV5BMTEzNjM2NTYxMjReQTJeQWpwZ15BbWU4MDU2NzAxNTUz._V1_SY139_CR1,0,92,139_.jpg",https://imdb.com/title/tt5052474?ref_=mojo_rl_summary&rf=mojo_rl_summary
rl3046475521,Pitch Perfect 3,"Following their win at the world championship, the now separated Bellas reunite for one last singing competition at an overseas USO tour, but face a group who uses both instruments and voices.",United States-China,English-Papiamento,,"Dec 29, 2017",PG-13,1 hr 33 min,Comedy-Music,5.8,72000,85,45000000,126276,104897530,185400345,"https://m.media-amazon.com/images/M/MV5BMTU5NDI1MjkwMF5BMl5BanBnXkFtZTgwNjIxNTY2MzI@._V1_SY139_CR1,0,92,139_.jpg",https://imdb.com/title/tt4765284?ref_=mojo_rl_summary&rf=mojo_rl_summary
rl3766519297,Darkest Hour,"In May 1940, the fate of World War II hangs on Winston Churchill, who must decide whether to negotiate with Adolf Hitler, or fight on knowing that it could mean the end of the British Empire.",United Kingdom-United States-China,English-French-German-Italian,,"Jan 19, 2018",PG-13,2 hr 5 min,Drama-War,7.4,221000,65,0,38671,56468410,150847207,"https://m.media-amazon.com/images/M/MV5BMjIyNDkyMTgzMV5BMl5BanBnXkFtZTgwNTQwNjg2MzI@._V1_SY139_CR1,0,92,139_.jpg",https://imdb.com/title/tt4555426?ref_=mojo_rl_summary&rf=mojo_rl_summary
rl4252337921,The House with a Clock in Its Walls,A young orphan named Lewis Barnavelt aids his magical uncle in locating a clock with the power to bring about the end of the world.,United States-Canada-India,English,CJ EntertainmentSee full company information,"Sep 28, 2018",PG,1 hr 45 min,Comedy-Family-Fantasy-Mystery-Sci-Fi,6.1,55000,0,42000000,188971,68549695,131457147,"https://m.media-amazon.com/images/M/MV5BN2EwYmMzZWQtOWFjNi00NWI1LThmODctNWQ5NzlmYmFmOTM0XkEyXkFqcGdeQXVyMzExODEzNDA@._V1_SY139_CR2,0,92,139_.jpg",https://imdb.com/title/tt2119543?ref_=mojo_rl_summary&rf=mojo_rl_summary
rl701072897,Bilal: A New Breed of Hero2018 Re-release,"A thousand years ago, one boy with a dream of becoming a great warrior is abducted with his sister and taken to a land far away from home. Thrown into a world where greed and injustice rule all, Bilal finds the courage to raise his voice and make a change. Inspired by true events, this is a story of a real hero who earned his remembrance in time and history.",United Arab Emirates,English,Mega Pictures,"Feb 2, 2018",PG-13,1 hr 45 min,Action-Adventure-Animation-Fantasy,7.6,19000,101,0,40183,490973,576805,"https://m.media-amazon.com/images/M/MV5BNmEyY2IxYTktMzIxMS00MzNmLTlmMjEtZGE1YzZkMDVjYzdiXkEyXkFqcGdeQXVyMTYxMzQzNTU@._V1_SX92_CR0,0,92,139_.jpg",https://imdb.com/title/tt3576728?ref_=mojo_rl_summary&rf=mojo_rl_summary
rl3470361601,Bilal: A New Breed of Hero,"A thousand years ago, one boy with a dream of becoming a great warrior is abducted with his sister and taken to a land far away from home. Thrown into a world where greed and injustice rule all, Bilal finds the courage to raise his voice and make a change. Inspired by true events, this is a story of a real hero who earned his remembrance in time and history.",United Arab Emirates,English,,"Jan 31, 2018",PG-13,1 hr 45 min,Action-Adventure-Animation-Fantasy,7.6,19000,101,0,35473,0,3254027,"https://m.media-amazon.com/images/M/MV5BNmEyY2IxYTktMzIxMS00MzNmLTlmMjEtZGE1YzZkMDVjYzdiXkEyXkFqcGdeQXVyMTYxMzQzNTU@._V1_SX92_CR0,0,92,139_.jpg",https://imdb.com/title/tt3576728?ref_=mojo_rl_summary&rf=mojo_rl_summary
rl1914799873,Kin,"Chased by a vengeful criminal, the feds and a gang of otherworldly soldiers, an ex-con and his adopted teenage brother go on the run with a weapon of mysterious origin as their only protection.",United States-Canada,English,Indokina,"Sep 14, 2018",PG-13,1 hr 42 min,Action-Drama-Sci-Fi-Thriller,5.8,19000,57,0,15357,5718096,10313019,"https://m.media-amazon.com/images/M/MV5BZDczYzNhMDMtNmQ2Ni00ZjcwLWI1MDQtMWI1YWVkNjkzN2NhXkEyXkFqcGdeQXVyNDMzMzI5MjM@._V1_SX92_CR0,0,92,139_.jpg",https://imdb.com/title/tt6017942?ref_=mojo_rl_summary&rf=mojo_rl_summary
rl3268707329,Based on a True Story,"A writer goes through a tough period after the release of her latest book, as she gets involved with an obsessive admirer.",France-Poland-Belgium,French,Galaxy Distribution,"Mar 23, 2018",Not Supplied,1 hr 40 min,Drama-Mystery-Thriller,5.7,7400,14,0,4275,0,3988331,"https://m.media-amazon.com/images/M/MV5BZGM5YzIxZWMtNzcwZC00YmU4LWE1M2UtZmZhYWZhNWEwODE5XkEyXkFqcGdeQXVyNDkzNTM2ODg@._V1_SY139_CR5,0,92,139_.jpg",https://imdb.com/title/tt5893264?ref_=mojo_rl_summary&rf=mojo_rl_summary
rl3079832577,I Still See You,Set ten years after an apocalyptic event that killed millions and left the world inhabited by ghosts.,United States,English,Noori PicturesSee full company information,"Oct 5, 2018",PG-13,1 hr 38 min,Fantasy-Horror-Mystery-Sci-Fi-Thriller,5.8,11000,0,0,45024,1359,1620637,"https://m.media-amazon.com/images/M/MV5BMjQ4MjI5MjkxMV5BMl5BanBnXkFtZTgwODU1ODIyNjM@._V1_SY139_CR3,0,92,139_.jpg",https://imdb.com/title/tt2160105?ref_=mojo_rl_summary&rf=mojo_rl_summary
rl3812067073,My Little Pony: The Movie,"After a dark force conquers Canterlot, the Mane 6 embark on an unforgettable journey beyond Equestria where they meet new friends and exciting challenges on a quest to use the magic of friendship to save their homeland.",United States-Canada-Bulgaria-Ireland-Philippines,English,Greem Media Co.,"Oct 20, 2017",PG,1 hr 39 min,Adventure-Animation-Comedy-Family-Fantasy-Music-Musical,6.1,8000,0,6500000,237588,21885107,60330833,"https://m.media-amazon.com/images/M/MV5BMmMxNWNhNjItZjhmMC00ZmViLThlYjItZDk5YTQ1MWZkOGM1XkEyXkFqcGdeQXVyNzY2ODYzOTU@._V1_SX92_CR0,0,92,139_.jpg",https://imdb.com/title/tt4131800?ref_=mojo_rl_summary&rf=mojo_rl_summary
rl2086110977,Only the Brave,"Based on the true story of the Granite Mountain Hotshots, a group of elite firefighters who risk everything to protect a town from a historic wildfire.",United States,English,BHD CO. LTD.,"Oct 20, 2017",PG-13,2 hr 14 min,Action-Biography-Drama,7.6,77000,0,38000000,133762,18343983,26351322,"https://m.media-amazon.com/images/M/MV5BYWFlOWI3YTMtYTk3NS00YWQ2LTlmYTMtZjk0ZDk4Y2NjODI0XkEyXkFqcGdeQXVyNTQxNTQ4Mg@@._V1_SY139_CR1,0,92,139_.jpg",https://imdb.com/title/tt3829920?ref_=mojo_rl_summary&rf=mojo_rl_summary
rl3578103553,The Fate of the Furious,"When a mysterious woman seduces Dominic Toretto into the world of terrorism and a betrayal of those closest to him, the crew face trials that will test them as never before.",United States-China-Japan,English-Russian-Spanish,Universal Pictures International (UPI)See full company information,"Apr 14, 2017",PG-13,2 hr 16 min,Action-Crime-Thriller,6.6,254000,112,250000000,6935211,226008385,1236005118,"https://m.media-amazon.com/images/M/MV5BMjMxODI2NDM5Nl5BMl5BanBnXkFtZTgwNjgzOTk1MTI@._V1_SX92_CR0,0,92,139_.jpg",https://imdb.com/title/tt4630562?ref_=mojo_rl_summary&rf=mojo_rl_summary
rl3654518273,The Boss Baby,"A suit-wearing, briefcase-carrying baby pairs up with his 7-year old brother to stop the dastardly plot of the CEO of Puppy Co.",United States,English-Spanish,20th Century Fox InternationalSee full company information,"Mar 31, 2017",PG,1 hr 37 min,Adventure-Animation-Comedy-Family-Fantasy,6.3,141000,230,0,4000590,175003033,527965936,"https://m.media-amazon.com/images/M/MV5BMTg5MzUxNzgxNV5BMl5BanBnXkFtZTgwMTM2NzQ3MjI@._V1_SY139_CR1,0,92,139_.jpg",https://imdb.com/title/tt3874544?ref_=mojo_rl_summary&rf=mojo_rl_summary
rl764184065,Despicable Me 3,"Gru meets his long-lost, charming, cheerful, and more successful twin brother Dru, who wants to team up with him for one last criminal heist.",United States-France-Japan,English,Universal Pictures International (UPI)See full company information,"Jun 30, 2017",PG,1 hr 29 min,Adventure-Animation-Comedy-Crime-Family-Sci-Fi,6.2,155000,120,80000000,3318385,264624300,1034799409,"https://m.media-amazon.com/images/M/MV5BNjUyNzQ2MTg3Ml5BMl5BanBnXkFtZTgwNzE4NDM3MTI@._V1_SX92_CR0,0,92,139_.jpg",https://imdb.com/title/tt3469046?ref_=mojo_rl_summary&rf=mojo_rl_summary
rl924419841,Journey to the West: The Demons Strike Back,A monk and his three disciples continue on their journey to battle demons.,China,Mandarin,Sony Pictures ReleasingSee full company information,"Jan 28, 2017",PG-13,1 hr 49 min,Adventure-Comedy-Fantasy,5.4,3600,154,0,2509277,880346,247585244,"https://m.media-amazon.com/images/M/MV5BMjA3MDM4OTk5OV5BMl5BanBnXkFtZTgwODg0MjMzMTI@._V1_SY139_CR0,0,92,139_.jpg",https://imdb.com/title/tt5273624?ref_=mojo_rl_summary&rf=mojo_rl_summary
rl1474791169,The Mummy,"An ancient Egyptian princess is awakened from her crypt beneath the desert, bringing with her malevolence grown over millennia and terrors that defy human comprehension.",United States-China-Japan,English-Egyptian (Ancient),Universal Pictures International (UPI)See full company information,"Jun 9, 2017",PG-13,1 hr 51 min,Action-Adventure-Fantasy-Horror-Thriller,5.4,206000,116,125000000,2427175,80227895,409231607,"https://m.media-amazon.com/images/M/MV5BMTkwMTgwODAxMl5BMl5BanBnXkFtZTgwNTEwNTQ3MDI@._V1_SX92_CR0,0,92,139_.jpg",https://imdb.com/title/tt2345759?ref_=mojo_rl_summary&rf=mojo_rl_summary
rl2791343105,Spider-Man: Homecoming,"Peter Parker balances his life as an ordinary high school student in Queens with his superhero alter-ego Spider-Man, and finds himself on the trail of a new menace prowling the skies of New York City.",United States,English-Spanish,Sony Pictures ReleasingSee full company information,"Jul 7, 2017",PG-13,2 hr 13 min,Action-Adventure-Sci-Fi,7.4,720000,305,175000000,2140029,334201140,880166924,"https://m.media-amazon.com/images/M/MV5BODY2MTAzOTQ4M15BMl5BanBnXkFtZTgwNzg5MTE0MjI@._V1_SY139_CR1,0,92,139_.jpg",https://imdb.com/title/tt2250912?ref_=mojo_rl_summary&rf=mojo_rl_summary
rl3282994945,Resident Evil: The Final Chapter,"Alice returns to where the nightmare began: The Hive in Raccoon City, where the Umbrella Corporation is gathering its forces for a final strike against the only remaining survivors of the apocalypse.",Germany-Canada,English,Sony Pictures ReleasingSee full company information,"Feb 10, 2017",R,1 hr 47 min,Action-Horror-Sci-Fi,5.5,101000,135,40000000,1200838,26830068,312242626,"https://m.media-amazon.com/images/M/MV5BMTc0Mzc2OTQ0Ml5BMl5BanBnXkFtZTgwOTQ5MjE4MDI@._V1_SY139_CR1,0,92,139_.jpg",https://imdb.com/title/tt2592614?ref_=mojo_rl_summary&rf=mojo_rl_summary
rl1714717697,Logan,"In a future where mutants are nearly extinct, an elderly and weary Logan leads a quiet life. But when Laura, a mutant child pursued by scientists, comes to him for help, he must get her to safety.",United States,English-Spanish,20th Century Fox InternationalSee full company information,"Mar 3, 2017",R,2 hr 17 min,Action-Drama-Sci-Fi-Thriller,8.1,833000,215,97000000,2296305,226277068,619021436,"https://m.media-amazon.com/images/M/MV5BYzc5MTU4N2EtYTkyMi00NjdhLTg3NWEtMTY4OTEyMzJhZTAzXkEyXkFqcGdeQXVyNjc1NTYyMjg@._V1_SY139_CR0,0,92,139_.jpg",https://imdb.com/title/tt3315342?ref_=mojo_rl_summary&rf=mojo_rl_summary
rl2019263489,Smurfs: The Lost Village,"A mysterious map sets Smurfette and her friends Brainy, Clumsy and Hefty on an exciting race through the Forbidden Forest, leading to the discovery of the biggest secret in Smurf history.",United States-Hong Kong-China-Czech Republic-United Kingdom,English,Sony Pictures ReleasingSee full company information,"Apr 28, 2017",PG,1 hr 30 min,Adventure-Animation-Comedy-Family-Fantasy,6,24000,140,60000000,1090419,45020282,197183546,"https://m.media-amazon.com/images/M/MV5BMjdlNTFmYWMtZmJmNi00OTEwLWJiMWUtYTY1ZjA1Y2RjMTY3XkEyXkFqcGdeQXVyNzg3MjIwMjg@._V1_SY139_CR1,0,92,139_.jpg",https://imdb.com/title/tt2398241?ref_=mojo_rl_summary&rf=mojo_rl_summary
rl3854403073,The Foreigner,"A humble businessman with a buried past seeks justice when his daughter is killed in an act of terrorism. A cat-and-mouse conflict ensues with a government official, whose past may hold clues to the killers' identities.",United Kingdom-China-United States-India,English-Mandarin,GSC Movies (GSCM)See full company information,"Oct 5, 2017",R,1 hr 53 min,Action-Thriller,7,123000,0,35000000,673511,34393507,145374099,"https://m.media-amazon.com/images/M/MV5BZWMwZGQzOWItYjM5Ny00MGQ5LTkzYjgtOGJmNjE3ODg4OTQxXkEyXkFqcGdeQXVyMjQwMjk0NjI@._V1_SY139_CR1,0,92,139_.jpg",https://imdb.com/title/tt1615160?ref_=mojo_rl_summary&rf=mojo_rl_summary
rl4149643009,The Great Wall,"In ancient China, a group of European mercenaries encounters a secret army that maintains and defends the Great Wall of China against a horde of monstrous creatures.",United States-China-Hong Kong-Australia-Canada,English-Mandarin-Spanish,Universal Pictures International (UPI)See full company information,"Feb 3, 2017",PG-13,1 hr 43 min,Action-Adventure-Fantasy-Thriller,5.9,147000,114,150000000,805200,45540830,334933831,"https://m.media-amazon.com/images/M/MV5BMjA3MjAzOTQxNF5BMl5BanBnXkFtZTgwOTc5OTY1OTE@._V1_SX92_CR0,0,92,139_.jpg",https://imdb.com/title/tt2034800?ref_=mojo_rl_summary&rf=mojo_rl_summary
