MovieID,Movie,Title_Summary,Country_of_origin,Language,Distributor,Release_Date,MPAA,Running_Time,Genres,Rating,Votes,Theaters,Budget,Total_Gross,Domestic,Worldwide,Image,IMDb_url
rl2421129985,Monster Zone,An intelligent 15-year-old high school student is unexpectedly transferred to a boarding school where he opens a portal of monsters from another dimension.,Mexico-United Kingdom-Canada-India-Hungary-United States-Netherlands-China,English,CJ CGV,"Aug 28, 2020",PG,1 hr 25 min,Adventure-Animation-Family-Fantasy-Horror,5.1,1100,909,0,110715,0,1423666,"https://m.media-amazon.com/images/M/MV5BZGQyMTdkNzctOGYwMS00ZmQxLTg0ODItNzM1MmIzYzlmNmRhXkEyXkFqcGdeQXVyMjgzNjA3Mw@@._V1_SY139_CR3,0,92,139_.jpg",https://imdb.com/title/tt8524650?ref_=mojo_rl_summary&rf=mojo_rl_summary
rl2892071681,Freaky,"After swapping bodies with a deranged serial killer, a high-school senior discovers that she has fewer than 24 hours before the change becomes permanent.",United States,English-Spanish,CJ CGV,"Nov 27, 2020",R,1 hr 42 min,Comedy-Horror-Thriller,6.3,73000,1489,0,120744,9030855,18073433,"https://m.media-amazon.com/images/M/MV5BMTRkYmJlY2ItNmFlZi00OWVhLTg1ZTctOGE0MjM5ZGMwMmY4XkEyXkFqcGdeQXVyNjY1MTg4Mzc@._V1_SX92_CR0,0,92,139_.jpg",https://imdb.com/title/tt10919380?ref_=mojo_rl_summary&rf=mojo_rl_summary
rl2656862977,My God! Father,"Got is a young and energetic racing man who hates his father. There is a reason for him to warp back in the year 1998, just a year before he was born, Got met his young father when he was Godfather.",Thailand,Thai,Not Supplied,"Nov 13, 2020",Not Supplied,1 hr 44 min,Comedy-Romance,5.2,179,1185,0,139511,0,139511,"https://m.media-amazon.com/images/M/MV5BMjYzOTQ4NzItYTliMS00Nzc1LWEzNTctMDY5MGU5YWMxNmYxXkEyXkFqcGdeQXVyMTEzNDczNjY3._V1_SY139_CR2,0,92,139_.jpg",https://imdb.com/title/tt13476378?ref_=mojo_rl_summary&rf=mojo_rl_summary
rl1917420289,A Piece of Cake,The legendary Elfkins (Heinzelmännchen) of Cologne were gnomes secretly helping craftsmen at night until they were ousted by a tailor's malevolent wife 200 years ago. This is the story of their return.,Germany,German,Not Supplied,"Oct 16, 2020",PG,1 hr 18 min,Animation-Comedy-Family-Fantasy,6,543,748,0,103180,0,6008448,"https://m.media-amazon.com/images/M/MV5BNDY1YjY1MTAtMDUyNi00M2JmLTg1N2UtMjIyNTU3ZGQwY2VkXkEyXkFqcGdeQXVyMjMwODE4ODI@._V1_SY139_CR6,0,92,139_.jpg",https://imdb.com/title/tt9037650?ref_=mojo_rl_summary&rf=mojo_rl_summary
rl481788417,The Room2020 Re-release,"In San Francisco, an amiable banker's seemingly perfect life is turned upside down when his deceitful fiancée embarks on an affair with his best friend.",United States,English,Lotte EntertainmentSee full company information,"Feb 7, 2020",R,1 hr 39 min,Drama,3.6,95000,990,0,102938,0,359806,"https://m.media-amazon.com/images/M/MV5BN2IwYzc4MjEtMzJlMS00MDJlLTkzNDAtN2E4NGNkZjg0MDgxXkEyXkFqcGdeQXVyMjQwMDg0Ng@@._V1_SY139_CR2,0,92,139_.jpg",https://imdb.com/title/tt0368226?ref_=mojo_rl_summary&rf=mojo_rl_summary
rl3208872705,Sea Fever,"The crew of a West of Ireland trawler, marooned at sea, struggle for their lives against a growing parasite in their water supply.",Ireland-United Kingdom-Sweden-Belgium,English-Irish Gaelic,CJ CGV,"Jun 26, 2020",Not Supplied,1 hr 35 min,Drama-Horror-Mystery-Sci-Fi-Thriller,5.8,14000,1297,0,102239,0,387740,"https://m.media-amazon.com/images/M/MV5BNjMyMTZhOTgtNTM0NS00MzAzLWI4YjMtMmQ2MDk4NjkwYWI4XkEyXkFqcGdeQXVyODE5NzE3OTE@._V1_SY139_CR1,0,92,139_.jpg",https://imdb.com/title/tt2716382?ref_=mojo_rl_summary&rf=mojo_rl_summary
rl3703144961,The Gentlemen,"An American expat tries to sell off his highly profitable marijuana empire in London, triggering plots, schemes, bribery and blackmail in an attempt to steal his domain out from under him.",United States-United Kingdom-France-Japan-Czech Republic,English-Russian-Spanish-Chinese,CJ CGV,"Feb 24, 2020",R,1 hr 53 min,Action-Crime,7.8,402000,570,22000000,101617,36471795,115171795,"https://m.media-amazon.com/images/M/MV5BMTlkMmVmYjktYTc2NC00ZGZjLWEyOWUtMjc2MDMwMjQwOTA5XkEyXkFqcGdeQXVyNTI4MzE4MDU@._V1_SY139_CR1,0,92,139_.jpg",https://imdb.com/title/tt8367814?ref_=mojo_rl_summary&rf=mojo_rl_summary
rl744063745,Tidal Wave,"A woman named Yeon-hee (Ha Ji-won) lives in Busan with her boyfriend Man-sik (Sol Kyung-gu) near Haeundae Beach. But, when they find out a tsunami will hit the city, They realize they only have 10 minutes to escape!",South Korea,Korean-English,CJ CGV,"Oct 16, 2020",R,2 hr,Action-Drama-Sci-Fi-Thriller,5.5,5200,1529,0,100499,0,71283278,"https://m.media-amazon.com/images/M/MV5BODA1MTE2OTIyM15BMl5BanBnXkFtZTgwMTA1MTE0MjE@._V1_SY139_CR3,0,92,139_.jpg",https://imdb.com/title/tt1153040?ref_=mojo_rl_summary&rf=mojo_rl_summary
rl1145078529,Inheritance,"The patriarch of a wealthy and powerful family suddenly passes away, leaving his daughter with a shocking secret inheritance that threatens to unravel and destroy the family.",United States,English,CJ CGV,"Jun 12, 2020",Not Supplied,1 hr 51 min,Drama-Mystery-Thriller,5.6,19000,1277,0,97085,0,304931,"https://m.media-amazon.com/images/M/MV5BYTYzZjE4NmEtZjQ2NC00NjNjLTlhNTItNjM3YTA3YTQyODk1XkEyXkFqcGdeQXVyMzQwMTY2Nzk@._V1_SY139_CR1,0,92,139_.jpg",https://imdb.com/title/tt7923220?ref_=mojo_rl_summary&rf=mojo_rl_summary
rl457409281,Latte & the Magic Waterstone,Follows the journey of a young hedgehog who wants to save the forest and its inhabitants from a horrible drought by reclaim a magical waterstone from the bear king.,Germany-Belgium,French-English,Galaxy International,"Jun 21, 2020",Not Supplied,1 hr 21 min,Adventure-Animation-Comedy-Family,5.6,1200,858,0,96263,0,5539765,"https://m.media-amazon.com/images/M/MV5BN2U3NTkxNjctMWEwMy00MmNiLTg0OTMtZTc3NzI1MGNmYWVjXkEyXkFqcGdeQXVyNjYxNzY5MjE@._V1_SY139_CR3,0,92,139_.jpg",https://imdb.com/title/tt9038290?ref_=mojo_rl_summary&rf=mojo_rl_summary
rl4181820161,Baba Yaga: Terror of the Dark Forest,"When Egor's mom dies, he gets a stepmom and then a baby half sister. Things get seriously twisted when his dad gets a hot nanny, who's the witch, Baba Yaga.",Russia,Russian-English,CJ CGV,"May 23, 2020",Not Supplied,1 hr 37 min,Adventure-Fantasy-Horror-Mystery,4.7,2100,1414,0,273988,0,1398488,"https://m.media-amazon.com/images/M/MV5BZDc0N2VkMGQtNDgyYi00Nzk5LTk1MDctZmE2MWFmNjcxYjhlXkEyXkFqcGdeQXVyMjUwNjY5MzA@._V1_SY139_CR2,0,92,139_.jpg",https://imdb.com/title/tt8006374?ref_=mojo_rl_summary&rf=mojo_rl_summary
rl760840961,Sputnik,The lone survivor of an enigmatic spaceship incident hasn't returned home alone - hiding inside his body is a dangerous creature.,Russia,Russian-Latin,CJ CGV,"Oct 16, 2020",Not Supplied,1 hr 53 min,Drama-Horror-Mystery-Sci-Fi-Thriller,6.4,27000,1411,0,103408,18853,354023,"https://m.media-amazon.com/images/M/MV5BOTI4ZmE4MDUtMTFjOS00NWNkLThkMzgtOTdmYzY4ODhmYTI0XkEyXkFqcGdeQXVyMTE1MzI2NzIz._V1_SY139_CR1,0,92,139_.jpg",https://imdb.com/title/tt11905962?ref_=mojo_rl_summary&rf=mojo_rl_summary
rl558203649,Low Season,"A girl with a special sense and can see the ghosts broke up with her boyfriend becoming tired of the big city and decided to leave the city for a break. She heads to the faraway resort in the North alone during the so-called ""Low Season"".",Thailand,Thai,Galaxy Distribution,"Jul 10, 2020",Not Supplied,2 hr 5 min,Comedy-Horror-Romance,6.4,651,775,0,103986,0,244704,"https://m.media-amazon.com/images/M/MV5BM2NlYWZmYTAtMmUwNC00NmRlLWE2N2YtYzUwNmRmZWE4OGZhXkEyXkFqcGdeQXVyODgwNDE1NzE@._V1_SY139_CR2,0,92,139_.jpg",https://imdb.com/title/tt11906392?ref_=mojo_rl_summary&rf=mojo_rl_summary
rl4206068225,Tootsies & the Fake,"Make way! 3 tootsies, 1 lesbian and an A-list superstar are coming! Get ready for their new adventures.",Thailand,Thai,Galaxy International,"Jan 25, 2020",Not Supplied,1 hr 49 min,Comedy,5.8,557,241,0,91587,0,224766,"https://m.media-amazon.com/images/M/MV5BYzNkZWRhYWEtYWU0ZS00ZmI2LTg3OWQtYzdjYjEzMjQ4YjRkXkEyXkFqcGdeQXVyMTMxODk2OTU@._V1_SY139_CR3,0,92,139_.jpg",https://imdb.com/title/tt11280100?ref_=mojo_rl_summary&rf=mojo_rl_summary
rl2421523201,"Turu, the Wacky Hen",A hen unable to lay eggs finds her life changed when she is sold to a music teacher.,Spain-Argentina,Spanish,CJ CGV,"Oct 2, 2020",Not Supplied,1 hr 20 min,Adventure-Animation-Family-Musical,4.7,336,957,0,91605,0,1461078,"https://m.media-amazon.com/images/M/MV5BODhjOThhYTItMTAxYS00MGY2LTg5NWEtMzE2OTM4NWRlYjQ4XkEyXkFqcGdeQXVyMTA4OTI0Nzk4._V1_SY139_CR2,0,92,139_.jpg",https://imdb.com/title/tt8790552?ref_=mojo_rl_summary&rf=mojo_rl_summary
rl2998239745,Secrets of the Wind,"Linh, an art student, moves to a new house where she encounters a ghost. She helps him to uncover the mysterious cause of his death realizing what is important in her life.",Vietnam,Vietnamese,BHD CO. LTD.,"Nov 20, 2020",Not Supplied,1 hr 59 min,Drama,7,37,773,0,84892,0,84892,"https://m.media-amazon.com/images/M/MV5BOTcwYjM5Y2MtM2NlOS00NGI4LTgyMzMtMjcwOTZmNWVkNGM1XkEyXkFqcGdeQXVyOTIxNDQ1MTQ@._V1_SY139_CR1,0,92,139_.jpg",https://imdb.com/title/tt11101894?ref_=mojo_rl_summary&rf=mojo_rl_summary
rl2494988801,Happy Old Year,"A woman wants to reorganize her house and convert it into a home office. She will throw away anything that has been lying around unused. However, she faces a great challenge when she comes across some items that belonged to her ex-boyfriend.",Thailand,Thai,Galaxy International,"Feb 14, 2020",Not Supplied,1 hr 53 min,Drama-Romance,7.2,2800,789,0,81294,0,115871,"https://m.media-amazon.com/images/M/MV5BOTVlMWFlZWUtZTM0ZC00MTE0LWE5ZjAtNGIzMTNjNTZiODcxXkEyXkFqcGdeQXVyNTk1NTkxMDI@._V1_SY139_CR2,0,92,139_.jpg",https://imdb.com/title/tt11316824?ref_=mojo_rl_summary&rf=mojo_rl_summary
rl1950974721,Unhinged,"After a confrontation with an unstable man at an intersection, a woman becomes the target of his rage.",United Kingdom-United States,English,CJ CGV,"Jul 31, 2020",R,1 hr 30 min,Action-Thriller,6,77000,934,0,80188,20831465,44331465,"https://m.media-amazon.com/images/M/MV5BYjc1Mjg5NjItY2I2MS00NDk3LWI5NGYtNzZjNTNiZmMwZTA3XkEyXkFqcGdeQXVyMjM4NTM5NDY@._V1_SY139_CR1,0,92,139_.jpg",https://imdb.com/title/tt10059518?ref_=mojo_rl_summary&rf=mojo_rl_summary
rl2489287425,The Tower,A Christmas Eve party at a luxury residential building takes a horrific turn when a fire breaks out.,South Korea,Korean-French,CJ CGV,"Nov 20, 2020",Not Supplied,2 hr 1 min,Action-Drama-Thriller,6.5,6800,1188,0,79081,0,36512327,"https://m.media-amazon.com/images/M/MV5BMzEyNTIzODI5NF5BMl5BanBnXkFtZTgwMzI1MTAzMjE@._V1_SY139_CR3,0,92,139_.jpg",https://imdb.com/title/tt2554270?ref_=mojo_rl_summary&rf=mojo_rl_summary
rl3394470657,Doctor Strange2020 Re-release,"While on a journey of physical and spiritual healing, a brilliant neurosurgeon is drawn into the world of the mystic arts.",United States,English,CJ CGV,"Sep 18, 2020",PG-13,1 hr 55 min,Action-Adventure-Fantasy-Sci-Fi,7.5,806000,1194,165000000,77681,0,78438,"https://m.media-amazon.com/images/M/MV5BNjgwNzAzNjk1Nl5BMl5BanBnXkFtZTgwMzQ2NjI1OTE@._V1_SY139_CR1,0,92,139_.jpg",https://imdb.com/title/tt1211837?ref_=mojo_rl_summary&rf=mojo_rl_summary
rl1129808641,The Clearing,A father must battle his way through the zombie apocalypse to save his daughter.,United States,English,Saigon Movies,"Oct 10, 2020",Not Supplied,1 hr 28 min,Horror,4.3,1100,911,0,77182,0,77182,"https://m.media-amazon.com/images/M/MV5BZDE2MWE2NzktNmUyYi00ZTdkLTk4NDktMjk1ZDFlZmJiMzYxXkEyXkFqcGdeQXVyMTY4NzI0Mzc@._V1_SY139_CR1,0,92,139_.jpg",https://imdb.com/title/tt7411112?ref_=mojo_rl_summary&rf=mojo_rl_summary
rl2656404225,Ava,"Ava is a deadly assassin who works for a black ops organization, traveling the globe specializing in high profile hits. When a job goes dangerously wrong she is forced to fight for her own survival.",United States,English-German-French-Chinese,Lotte EntertainmentSee full company information,"Oct 2, 2020",R,1 hr 36 min,Action-Drama-Thriller,5.5,63000,1163,0,76944,497747,3293783,"https://m.media-amazon.com/images/M/MV5BMTMzMTg1MjgtOWNhYy00NmZmLWExOTctMjA2OTZhZDFkNDhhXkEyXkFqcGdeQXVyNzAwMjU2MTY@._V1_SY139_CR1,0,92,139_.jpg",https://imdb.com/title/tt8784956?ref_=mojo_rl_summary&rf=mojo_rl_summary
rl2168554241,Coma,"After a mysterious accident, a young architect comes back to his senses in a very odd world. He must find out the exact laws and regulations of it while he fights for his life and keeps looking for an exit to the real world.",Russia,Russian,Galaxy International,"May 29, 2020",Not Supplied,1 hr 51 min,Action-Adventure-Mystery-Sci-Fi,6.3,12000,945,0,76877,0,2275710,"https://m.media-amazon.com/images/M/MV5BNDE5ODg1Y2MtNmQ4MC00M2U4LTk2YTktMGI5ZGJmNTExNjE1XkEyXkFqcGdeQXVyODc0OTEyNDU@._V1_SY139_CR6,0,92,139_.jpg",https://imdb.com/title/tt6087226?ref_=mojo_rl_summary&rf=mojo_rl_summary
rl1111786241,Relic,"A daughter, mother and grandmother are haunted by a manifestation of dementia that consumes their family's home.",Australia-United States-China,English,CJ CGV,"Jul 17, 2020",R,1 hr 29 min,Drama-Horror-Mystery-Thriller,6,30000,747,0,78463,1047083,2902552,"https://m.media-amazon.com/images/M/MV5BOGY1MGM2ZjItZDJjMC00ZGM0LTg2MDctNmExNzcyYTcwMjM3XkEyXkFqcGdeQXVyMTkxNjUyNQ@@._V1_SY139_CR1,0,92,139_.jpg",https://imdb.com/title/tt9072352?ref_=mojo_rl_summary&rf=mojo_rl_summary
rl3211100929,Skylines,"When a virus threatens to turn the now earth-dwelling friendly alien hybrids against humans, Captain Rose Corley must lead a team of elite mercenaries on a mission to the alien world in order to save what's left of humanity.",United Kingdom-United States,English,CJ CGV,"Dec 11, 2020",R,1 hr 53 min,Action-Adventure-Sci-Fi,4.8,9200,960,0,69808,0,170581,"https://m.media-amazon.com/images/M/MV5BZjRmNDJjMGYtNTQ5MC00ZGNhLWEzZDQtMjUzNjU3YmQzMmMxXkEyXkFqcGdeQXVyMTkxNjUyNQ@@._V1_SY139_CR1,0,92,139_.jpg",https://imdb.com/title/tt9387250?ref_=mojo_rl_summary&rf=mojo_rl_summary
rl279740929,Red Shoes and the Seven Dwarfs,"Princes who have been turned into Dwarfs seek the red shoes of a lady in order to break the spell, although it will not be easy. A parody with a twist.",South Korea,English,CJ CGV,"Dec 27, 2019",PG,1 hr 32 min,Action-Adventure-Animation-Comedy-Family-Fantasy-Romance,6.4,5400,499,0,110168,0,10108683,"https://m.media-amazon.com/images/M/MV5BMTcyZGRmNTUtM2Q5ZC00NzYzLTk1MjktNDYyYTUzNDBhMTkwXkEyXkFqcGdeQXVyOTg4MDYyNw@@._V1_SY139_CR1,0,92,139_.jpg",https://imdb.com/title/tt4429160?ref_=mojo_rl_summary&rf=mojo_rl_summary
rl641762049,Toi La Nao Ca Vang,,Vietnam,Vietnamese,Galaxy International,"Jun 5, 2020",Not Supplied,,Comedy-Romance,0,0,1086,0,69910,0,69910,"https://m.media-amazon.com/images/M/MV5BMjU0NTMxNTktNjVhNi00M2M1LWI2ODktMWJjNWY3NGQ5Y2YwXkEyXkFqcGdeQXVyNDc0Njc1NTY@._V1_SY139_CR1,0,92,139_.jpg",https://imdb.com/title/tt12485980?ref_=mojo_rl_summary&rf=mojo_rl_summary
rl3360916225,Invasion,"With the fall of the alien ship Julia's life changed, now three years later mankind is about to experience new encounter.",Russia,Russian-English,Lotte EntertainmentSee full company information,"Sep 18, 2020",Not Supplied,2 hr 14 min,Action-Sci-Fi,5.6,6100,690,0,65316,0,16653687,"https://m.media-amazon.com/images/M/MV5BMGFmMTM0ZGItYjlhZi00OGU2LWJjODctY2EyODAyYmQwYmZlXkEyXkFqcGdeQXVyMTA3NTQ1NDEw._V1_SY139_CR3,0,92,139_.jpg",https://imdb.com/title/tt8060328?ref_=mojo_rl_summary&rf=mojo_rl_summary
rl363627009,Start-Up,Two boys are becoming real adults during a turbulent time as they experience a world that doesn't go their way.,South Korea,Korean,,"Dec 27, 2019",Not Supplied,1 hr 42 min,Action-Comedy-Drama,6.5,1300,274,0,85749,0,24106579,"https://m.media-amazon.com/images/M/MV5BNTY4ZWNkNmItYzVkOC00ZTY4LTgyYjgtZTM2NDNiMzQ3YzczXkEyXkFqcGdeQXVyMDM1MzY1Mg@@._V1_SY139_CR2,0,92,139_.jpg",https://imdb.com/title/tt11454170?ref_=mojo_rl_summary&rf=mojo_rl_summary
rl608207617,The Night Clerk,A voyeuristic hotel clerk becomes the subject of a murder investigation.,United States,English,CJ CGV,"Jun 4, 2020",R,1 hr 30 min,Crime-Drama-Mystery-Romance-Thriller,5.6,19000,1055,0,62503,0,302127,"https://m.media-amazon.com/images/M/MV5BNTVjZGM0NTQtMDcyYi00Mzk5LTkyN2MtNWQxZjczMGIwOTAyXkEyXkFqcGdeQXVyMTkxNjUyNQ@@._V1_SY139_CR0,0,92,139_.jpg",https://imdb.com/title/tt7979142?ref_=mojo_rl_summary&rf=mojo_rl_summary
rl3629875969,Thang Máy,"After her best friend goes missing, a claustrophobic college girl investigates the mysterious elevator where her friend was last seen, and which may be the door to a terrifying dark world.",Vietnam,Vietnamese-English,Not Supplied,"Oct 30, 2020",Not Supplied,1 hr 20 min,Horror,4,92,1018,0,62272,0,247351,"https://m.media-amazon.com/images/M/MV5BZTE2MjcyOGEtOTJiYS00NDU2LWI2M2YtYTI4ZmM2OGYyNTc0XkEyXkFqcGdeQXVyMTIwNDgwODAz._V1_SY139_CR1,0,92,139_.jpg",https://imdb.com/title/tt13017046?ref_=mojo_rl_summary&rf=mojo_rl_summary
rl3847062273,Rogue,"O'Hara is a mercenary leading a squad of soldiers on their mission to rescue hostages in a remote part of Africa. Unfortunately, the mission goes awry and the team is stranded and forced to survive against the local rebels.",United States-South Africa-United Kingdom,English,CJ CGV,"Aug 21, 2020",R,1 hr 45 min,Action-Horror-Thriller,4.2,9800,1033,0,62129,0,242884,"https://m.media-amazon.com/images/M/MV5BZWUyY2M2M2UtMGI1NC00ZjBmLWI5NDItYjQ1MThjNzgwMjhmXkEyXkFqcGdeQXVyMDA4NzMyOA@@._V1_SY139_CR1,0,92,139_.jpg",https://imdb.com/title/tt11576124?ref_=mojo_rl_summary&rf=mojo_rl_summary
rl2957214465,Achoura,"Four childhood friends are reunited when one of them surfaces after twenty years, forcing them to confront a creature straight out of a spine-chilling Moroccan legend.",Morocco-France,French,Galaxy International,"Jun 26, 2020",Not Supplied,1 hr 33 min,Fantasy-Horror-Thriller,4.9,495,1039,0,60148,0,355270,"https://m.media-amazon.com/images/M/MV5BY2QyOGFhZmYtZjY1NC00MmYxLTkyZTEtZjAzMGJhMGFmOTIyXkEyXkFqcGdeQXVyNzEyMDU1MzU@._V1_SY139_CR1,0,92,139_.jpg",https://imdb.com/title/tt4188180?ref_=mojo_rl_summary&rf=mojo_rl_summary
rl2269217537,Samsam,SamSam appears to have it all: his own flying saucer and great family and friends. But the one thing he has yet to attain are actual superpowers.,Belgium-France,French,Galaxy International,"Mar 13, 2020",Not Supplied,1 hr 17 min,Adventure-Animation-Family,4.9,255,533,0,60087,53273,3266031,"https://m.media-amazon.com/images/M/MV5BNDZkZTRiOTktNDlhMS00YmI5LWI5OGEtNTMxNzg2NTllZTkzXkEyXkFqcGdeQXVyNzc0MTgzMzU@._V1_SY139_CR1,0,92,139_.jpg",https://imdb.com/title/tt9784518?ref_=mojo_rl_summary&rf=mojo_rl_summary
rl407077633,Stare,"There is a mystery afoot. Corpses are discovered whose eyeballs have collapsed, and autopsies show that the bodies had suffered heart attacks just before death. NMarie's friend dies in the blink of an eye right before her. As she and a friend begin to investigate more deaths occur until someone about to meet the same fate utters words that refer to a Shirai.",Japan,Japanese,Lotte EntertainmentSee full company information,"Jun 21, 2020",Not Supplied,1 hr 38 min,Horror-Mystery,4.9,109,1123,0,53545,0,71453,"https://m.media-amazon.com/images/M/MV5BMzVlMTI4NDEtYjc5Yy00MDc0LThmNDQtOTE0ZmE2OTM2NTNkXkEyXkFqcGdeQXVyMTIzMjUxMg@@._V1_SY139_CR3,0,92,139_.jpg",https://imdb.com/title/tt10240720?ref_=mojo_rl_summary&rf=mojo_rl_summary
rl1161855745,The Wishmas Tree,A young possum's misguided wish for a white Wishmas freezes her entire hometown of Sanctuary City and threatens all who live there.,Australia,Not Supplied,CJ CGV,"Jun 12, 2020",Not Supplied,1 hr 30 min,Animation,4.8,315,873,0,49238,0,1793562,"https://m.media-amazon.com/images/M/MV5BMjNlMjU2MDAtM2UwOS00ZDY2LTkyODUtZGI5NDgxMzY1MjY4XkEyXkFqcGdeQXVyNjI5NzQ1MTI@._V1_SY139_CR1,0,92,139_.jpg",https://imdb.com/title/tt9239422?ref_=mojo_rl_summary&rf=mojo_rl_summary
rl112951809,The Late Night Ride,A young jobless man who works for the mafia to pay off a big family debt falls in love with a mysterious motorbike taxi rider. But their love might not be the product of a coincidence.,Vietnam,Vietnamese,,"Feb 28, 2020",Not Supplied,1 hr 22 min,Action-Drama,6,8,914,0,47803,0,47803,"https://m.media-amazon.com/images/M/MV5BNzFjODRlYTItZjI5MC00NTEwLWI5OGUtMDE3ZDlmMTNkNTE1XkEyXkFqcGdeQXVyOTIxNDQ1MTQ@._V1_SY139_CR3,0,92,139_.jpg",https://imdb.com/title/tt11856638?ref_=mojo_rl_summary&rf=mojo_rl_summary
rl3377693441,Oh! My Gran,"Set in the peaceful town of Geumsan. Bo-Mi gets into an hit-and-run accident. The witnesses of the accident are Bo-Mi's grandmother Moon-Hee and her dog Aengja, but Moon-Hee has Alzheimer's disease.",South Korea,Korean,CJ CGV,"Sep 18, 2020",Not Supplied,1 hr 49 min,Comedy-Drama,6,278,618,0,46734,0,2182869,"https://m.media-amazon.com/images/M/MV5BYWVmY2I3MWYtMDE0Mi00YTc2LTgwZWUtMWM3YjdjM2IzNDcxXkEyXkFqcGdeQXVyODcwODUzOTM@._V1_SY139_CR3,0,92,139_.jpg",https://imdb.com/title/tt13148808?ref_=mojo_rl_summary&rf=mojo_rl_summary
rl3830285057,Simon's Got a Gift,"Simon is 8 and he's an orphan. His dream is to find a family willing to take him in. But Simon is not a child like the others, he has a secret power: he is able to take the appearance of every person he has ever touched.",France-Belgium,French,CJ CGV,"Aug 21, 2020",Not Supplied,1 hr 43 min,Drama-Family-Romance-Sci-Fi,6.6,725,575,0,45072,0,137358,"https://m.media-amazon.com/images/M/MV5BNWI3ZjI5MWItZWM0YS00YTIwLWExNDctZThhYmIxYjEzYjhhXkEyXkFqcGdeQXVyODIyOTEyMzY@._V1_SY139_CR5,0,92,139_.jpg",https://imdb.com/title/tt6487174?ref_=mojo_rl_summary&rf=mojo_rl_summary
rl3779953409,Inception10th Anniversary re-release,"A thief who steals corporate secrets through the use of dream-sharing technology is given the inverse task of planting an idea into the mind of a C.E.O., but his tragic past may doom the project and his team to disaster.",United States-United Kingdom,English-Japanese-French,CJ CGV,"Aug 21, 2020",PG-13,2 hr 28 min,Action-Adventure-Sci-Fi-Thriller,8.8,2600000,1206,160000000,6278,0,9581100,"https://m.media-amazon.com/images/M/MV5BMjAxMzY3NjcxNF5BMl5BanBnXkFtZTcwNTI5OTM0Mw@@._V1_SY139_CR1,0,92,139_.jpg",https://imdb.com/title/tt1375666?ref_=mojo_rl_summary&rf=mojo_rl_summary
rl531399169,Rambo: Last Blood,Rambo must confront his past and unearth his ruthless combat skills to exact revenge in a final mission.,United States-Hong Kong-France-Bulgaria-Spain-Sweden,English-Spanish,CJ CGV,"Dec 26, 2019",R,1 hr 29 min,Action-Crime-Thriller,6.1,110000,650,50000000,147152,44819352,91490353,"https://m.media-amazon.com/images/M/MV5BNTAxZWM2OTgtOTQzOC00ZTI5LTgyYjktZTRhYWM4YWQxNWI0XkEyXkFqcGdeQXVyMjMwNDgzNjc@._V1_SY139_CR1,0,92,139_.jpg",https://imdb.com/title/tt1206885?ref_=mojo_rl_summary&rf=mojo_rl_summary
rl2444132865,Bikeman 2,"The story of Sakkarin continues from ""Bikeman"". Sakkarin is now on his full-speed hitting on Jai but love comes with as obstacle as he has to face with challenges posted by Jai's intimidating father.",Thailand,Thai,Lotte EntertainmentSee full company information,"Oct 1, 2020",Not Supplied,,Comedy,6.1,296,635,0,42710,0,42710,"https://m.media-amazon.com/images/M/MV5BNjEyNmRjMWItNjg3Yi00MmU2LWI5NGItMmNjOGRkMThhM2NiXkEyXkFqcGdeQXVyNjkyMjYxMzY@._V1_SY139_CR2,0,92,139_.jpg",https://imdb.com/title/tt11204336?ref_=mojo_rl_summary&rf=mojo_rl_summary
rl3719922177,Mr. Zoo: The Missing VIP,Top National Security agent and zoophobe Tae-ju suddenly receives an ability to talk to the animals after a freak accident?,South Korea,Korean-English,CJ CGV,"Feb 21, 2020",Not Supplied,1 hr 54 min,Action-Comedy,5.6,538,447,0,41327,0,4426608,"https://m.media-amazon.com/images/M/MV5BYmMxMWU1MTUtY2Q0YS00YmEwLTg4OWUtMjUxOTkyNzYzNmEyXkEyXkFqcGdeQXVyNTM0MDc1ODE@._V1_SY139_CR2,0,92,139_.jpg",https://imdb.com/title/tt11566166?ref_=mojo_rl_summary&rf=mojo_rl_summary
rl828146433,The Evil Next Door,"A dad moves into a new house with his son and girlfriend. When he's out of town working, the son makes a new ""friend"" next door.",Sweden,Swedish,Not Supplied,"Jun 11, 2020",Not Supplied,1 hr 27 min,Horror-Mystery-Thriller,5.2,2600,471,0,42801,1010,1330726,"https://m.media-amazon.com/images/M/MV5BNjVjYjg1YjctZWIxOS00ZDAyLTg5NTctZWEwZWJmZGI1NjIzXkEyXkFqcGdeQXVyMTEyMjM2NDc2._V1_SY139_CR1,0,92,139_.jpg",https://imdb.com/title/tt11320192?ref_=mojo_rl_summary&rf=mojo_rl_summary
rl1900643073,Big Hero 62020 Re-release,"A special bond develops between plus-sized inflatable robot Baymax and prodigy Hiro Hamada, who together team up with a group of friends to form a band of high-tech heroes.",United States,English,CJ CGV,"Jul 31, 2020",PG,1 hr 42 min,Action-Adventure-Animation-Comedy-Crime-Family-Sci-Fi,7.8,503000,703,165000000,40318,0,41673,"https://m.media-amazon.com/images/M/MV5BMDliOTIzNmUtOTllOC00NDU3LWFiNjYtMGM0NDc1YTMxNjYxXkEyXkFqcGdeQXVyNTM3NzExMDQ@._V1_SY139_CR2,0,92,139_.jpg",https://imdb.com/title/tt2245084?ref_=mojo_rl_summary&rf=mojo_rl_summary
rl1111655169,Force of Nature,A gang of thieves plan a heist during a hurricane and encounter trouble when a cop tries to force everyone in the building to evacuate.,United States,English-Spanish,CJ CGV,"Jul 3, 2020",R,1 hr 31 min,Action-Adventure-Crime-Drama-Mystery-Thriller,4.6,13000,723,0,37724,0,638221,"https://m.media-amazon.com/images/M/MV5BNjZjODI5NmUtZTM3ZS00ZDkyLWJiMDYtYjI4MzFhODg1MDFmXkEyXkFqcGdeQXVyOTg4MDYyNw@@._V1_SY139_CR0,0,92,139_.jpg",https://imdb.com/title/tt10308928?ref_=mojo_rl_summary&rf=mojo_rl_summary
rl2673181441,Transference,"Joshua must protect his twin-sister, Emma, who possesses supernatural abilities and keep her safe from an unstoppable secret agent hunting them for an experiment in a classified government program.",Canada,English,CJ CGV,"Oct 2, 2020",Not Supplied,1 hr 26 min,Action-Mystery-Sci-Fi,4.1,2400,775,0,37483,0,37483,"https://m.media-amazon.com/images/M/MV5BMDg2NTNjOTEtNmNiNi00ZmQ0LWI2ODctOTY2MWNiOTBlZGM4XkEyXkFqcGdeQXVyOTMzOTMzMTg@._V1_SY139_CR0,0,92,139_.jpg",https://imdb.com/title/tt7159566?ref_=mojo_rl_summary&rf=mojo_rl_summary
