MovieID,Movie,Title_Summary,Country_of_origin,Language,Distributor,Release_Date,MPAA,Running_Time,Genres,Rating,Votes,Theaters,Budget,Total_Gross,Domestic,Worldwide,Image,IMDb_url
rl3102638849,Hanh Phúc Máu,"Traveling home after years of studying abroad, a receptive pharmacist soon gets held back by the filial duties of his superstitious family and a series of unexplained murders happening in the house.",Vietnam,Vietnamese,Warner Bros.See full company information,"Nov 24, 2022",Not Supplied,1 hr 48 min,Drama-Horror-Thriller,5.2,60,2137,0,775023,0,775023,"https://m.media-amazon.com/images/M/MV5BODQ5ZjU4NjgtNGVkZi00YWY0LWFmYTYtMDZlYWVlYWM3NmEyXkEyXkFqcGdeQXVyNDc0Njc1NTY@._V1_SY139_CR9,0,92,139_.jpg",https://imdb.com/title/tt23747380?ref_=mojo_rl_summary&rf=mojo_rl_summary
rl2011595521,Don't Look at the Demon,"A team of paranormal investigators head for the highlands of Fraser's Hill, Malaysia, to probe a series of alleged disturbances at a house with a dark past.",Malaysia,English,Galaxy Studio,"Oct 28, 2022",Not Supplied,1 hr 35 min,Horror-Mystery-Thriller,5.1,466,3080,0,849299,0,869325,"https://m.media-amazon.com/images/M/MV5BYTU4OGI0MTAtYTNlYS00ZTU3LTliZGQtOTcwNGFjM2QxZGI1XkEyXkFqcGdeQXVyNTA2MDM0MTY@._V1_SY139_CR3,0,92,139_.jpg",https://imdb.com/title/tt5249706?ref_=mojo_rl_summary&rf=mojo_rl_summary
rl4292838145,Avatar2022  Re-release,A paraplegic Marine dispatched to the moon Pandora on a unique mission becomes torn between following his orders and protecting the world he feels is his home.,United States,English-Spanish,Galaxy Studio,"Sep 23, 2022",PG-13,2 hr 42 min,Action-Adventure-Fantasy-Sci-Fi,7.9,1400000,3511,237000000,797400,24714024,76012917,"https://m.media-amazon.com/images/M/MV5BZDA0OGQxNTItMDZkMC00N2UyLTg3MzMtYTJmNjg3Nzk5MzRiXkEyXkFqcGdeQXVyMjUzOTY1NTc@._V1_SY139_CR1,0,92,139_.jpg",https://imdb.com/title/tt0499549?ref_=mojo_rl_summary&rf=mojo_rl_summary
rl315851521,Detective Conan: The Bride of Halloween,"During the wedding of Takagi and Sato, an assailant breaks and tries to attack Sato. But Takagi protects her while getting injured. The attacker escapes, but the situation is settled, although Sato is rightfully rattled by it all.",Japan,Japanese,CGV/Tagger,"Jul 22, 2022",Not Supplied,1 hr 51 min,Action-Animation-Crime-Mystery-Thriller,6.8,1700,3077,0,2401302,0,72699093,"https://m.media-amazon.com/images/M/MV5BNTE5NzNhNzYtY2YxOC00ZjY2LTk5MzctNWY0NDdiN2IxNzc0XkEyXkFqcGdeQXVyMTA0MTM5NjI2._V1_SY139_CR0,0,92,139_.jpg",https://imdb.com/title/tt19770970?ref_=mojo_rl_summary&rf=mojo_rl_summary
rl3476718337,Sonic the Hedgehog 2,"When the manic Dr. Robotnik returns to Earth with a new ally, Knuckles the Echidna, Sonic and his new friend Tails is all that stands in their way.",United States-Japan,English-Russian-French-Latin-Hawaiian-Greek,Universal PicturesSee full company information,"Apr 15, 2022",PG,2 hr 2 min,Action-Adventure-Comedy-Family-Fantasy-Sci-Fi,6.5,88000,1575,0,715994,190872904,405421518,"https://m.media-amazon.com/images/M/MV5BODRlNTY5ZjktZjE0Ni00YjZhLTk3NTItYzk0ZjYxN2QxMWEzXkEyXkFqcGdeQXVyMjMwNDgzNjc@._V1_SY139_CR1,0,92,139_.jpg",https://imdb.com/title/tt12412888?ref_=mojo_rl_summary&rf=mojo_rl_summary
rl892437249,Moonfall,A mysterious force knocks the moon from its orbit and sends it hurtling on a collision course toward earth.,United States-China-United Kingdom-Canada-Hong Kong,English-Chinese-Spanish-French,Universal PicturesSee full company information,"Feb 18, 2022",PG-13,2 hr 10 min,Action-Adventure-Sci-Fi,5.1,100000,2610,0,646171,19060660,67319703,"https://m.media-amazon.com/images/M/MV5BZjk0OWZiN2ItNmQ2YS00NTJmLTg0MjItNzM4NzBkMWM1ZTRlXkEyXkFqcGdeQXVyMjMxOTE0ODA@._V1_SY139_CR3,0,92,139_.jpg",https://imdb.com/title/tt5834426?ref_=mojo_rl_summary&rf=mojo_rl_summary
rl2932704001,The Witch: Part 2 - The Other One,"A girl wakes up in a secret laboratory and meets Kyung-hee, who is trying to protect her from a gang. When the gang finally finds the girl, they are overwhelmed by an unexpected power.",South Korea,Korean,Lotte EntertainmentSee full company information,"Jun 30, 2022",Not Supplied,2 hr 17 min,Action-Mystery-Thriller,6.3,6600,3321,0,763366,143723,23068596,"https://m.media-amazon.com/images/M/MV5BNWNiZDc3NWUtNmQ5ZS00MTI0LWFjNGQtZGUwZDlmZmU0N2QyXkEyXkFqcGdeQXVyNTIxNTMxMjE@._V1_SY139_CR0,0,92,139_.jpg",https://imdb.com/title/tt13721828?ref_=mojo_rl_summary&rf=mojo_rl_summary
rl3670704897,The Black Phone,"After being abducted by a child killer and locked in a soundproof basement, a 13-year-old boy starts receiving calls on a disconnected phone from the killer's previous victims.",United States,English,Universal Pictures International (UPI)See full company information,"Jun 24, 2022",R,1 hr 43 min,Horror-Mystery-Thriller,6.9,195000,3240,0,694953,90123230,161440742,"https://m.media-amazon.com/images/M/MV5BMWQxOGJlNTUtYTc1YS00NDkyLWExZjItMTFiYWEzMjAzYTdjXkEyXkFqcGdeQXVyNjk1Njg5NTA@._V1_SY139_CR9,0,92,139_.jpg",https://imdb.com/title/tt7144666?ref_=mojo_rl_summary&rf=mojo_rl_summary
rl1137869569,Bullet Train,Five assassins aboard a swiftly-moving bullet train find out that their missions have something in common.,Japan-United States,English-Japanese-Spanish-Russian,Galaxy Studio,"Aug 5, 2022",R,2 hr 7 min,Action-Comedy-Thriller,7.3,430000,2461,0,588362,103368602,239268602,"https://m.media-amazon.com/images/M/MV5BMDU2ZmM2OTYtNzIxYy00NjM5LTliNGQtN2JmOWQzYTBmZWUzXkEyXkFqcGdeQXVyMTkxNjUyNQ@@._V1_SY139_CR1,0,92,139_.jpg",https://imdb.com/title/tt12593682?ref_=mojo_rl_summary&rf=mojo_rl_summary
rl4007691009,Smile,"After witnessing a bizarre, traumatic incident involving a patient, a psychiatrist becomes increasingly convinced she is being threatened by an uncanny entity.",United States,English-Spanish,CGV Mars DagitimSee full company information,"Oct 7, 2022",R,1 hr 55 min,Horror-Mystery-Thriller,6.5,162000,2820,0,554922,105935048,217408513,"https://m.media-amazon.com/images/M/MV5BZjE2ZWIwMWEtNGFlMy00ZjYzLWEzOWEtYzQ0MDAwZDRhYzNjXkEyXkFqcGdeQXVyMTUzMTg2ODkz._V1_SY139_CR1,0,92,139_.jpg",https://imdb.com/title/tt15474916?ref_=mojo_rl_summary&rf=mojo_rl_summary
rl1059685121,F9: The Fast Saga,Dom and the crew must take on an international terrorist who turns out to be Dom and Mia's estranged brother.,United States-Thailand-Canada,English-Japanese-Spanish,Universal PicturesSee full company information,"Jan 7, 2022",PG-13,2 hr 23 min,Action-Crime-Thriller,5.2,162000,2360,0,539072,173005945,726229501,"https://m.media-amazon.com/images/M/MV5BMjI0NmFkYzEtNzU2YS00NTg5LWIwYmMtNmQ1MTU0OGJjOTMxXkEyXkFqcGdeQXVyMjMxOTE0ODA@._V1_SX92_CR0,0,92,139_.jpg",https://imdb.com/title/tt5433138?ref_=mojo_rl_summary&rf=mojo_rl_summary
rl835355393,Lightyear,"While spending years attempting to return home, marooned Space Ranger Buzz Lightyear encounters an army of ruthless robots commanded by Zurg who are attempting to steal his fuel source.",United States-Japan,English,BTeam PicturesSee full company information,"Jun 17, 2022",PG,1 hr 45 min,Action-Adventure-Animation-Comedy-Family-Sci-Fi,6.1,124000,1274,0,487138,118307188,226425420,"https://m.media-amazon.com/images/M/MV5BYTg2Zjk0ZTctM2ZmMi00MDRmLWJjOGYtNWM0YjBmZTBjMjRkXkEyXkFqcGdeQXVyMTM1MTE1NDMx._V1_SY139_CR1,0,92,139_.jpg",https://imdb.com/title/tt10298810?ref_=mojo_rl_summary&rf=mojo_rl_summary
rl180454145,Chickenhare and the Hamster of Darkness,"Follows a young hero born half chicken and half hare. Eager to fit in and feel loved in spite of his differences, he is obsessed by adventuring in spite of his clumsiness.",Belgium-France,English,Universal PicturesSee full company information,"Apr 29, 2022",Not Supplied,1 hr 31 min,Adventure-Animation-Comedy-Family,6.3,2500,1518,0,484358,0,10885116,"https://m.media-amazon.com/images/M/MV5BOTE1MmZiZDQtYjA3Yy00OWQwLWIzY2ItMDVkNTIxNzUxNTljXkEyXkFqcGdeQXVyMTEwNTM4MDcx._V1_SY139_CR5,0,92,139_.jpg",https://imdb.com/title/tt12532368?ref_=mojo_rl_summary&rf=mojo_rl_summary
rl808026881,Survive (Ta Nang - Phan Dung),,Vietnam,Vietnamese,Galaxy Distribution,"Dec 30, 2021",Not Supplied,,Adventure-Drama-Thriller,4.4,54,1094,0,644572,0,644572,"https://m.media-amazon.com/images/M/MV5BZGRkZTgzNzUtMjI5MS00NTc5LWIyOTMtOGUxZDc1YzY4M2Q0XkEyXkFqcGdeQXVyMTEzNTEwMjgx._V1_SY139_CR2,0,92,139_.jpg",https://imdb.com/title/tt12257650?ref_=mojo_rl_summary&rf=mojo_rl_summary
rl2687271681,Encanto,A Colombian teenage girl has to face the frustration of being the only member of her family without magical powers.,United States,English-Spanish,Walt Disney PicturesSee full company information,"Feb 1, 2022",PG,1 hr 42 min,Animation-Comedy-Family-Fantasy-Musical,7.2,263000,991,0,564327,96093622,256786742,"https://m.media-amazon.com/images/M/MV5BNjE5NzA4ZDctOTJkZi00NzM0LTkwOTYtMDI4MmNkMzIxODhkXkEyXkFqcGdeQXVyNjY1MTg4Mzc@._V1_SY139_CR1,0,92,139_.jpg",https://imdb.com/title/tt2953050?ref_=mojo_rl_summary&rf=mojo_rl_summary
rl3408757505,Sing 2,Buster Moon and his friends must persuade reclusive rock star Clay Calloway to join them for the opening of a new show.,United States-Japan-France,English,Universal PicturesSee full company information,"Feb 1, 2022",PG,1 hr 50 min,Adventure-Animation-Comedy-Family-Musical,7.3,87000,989,0,555715,162790990,408402685,"https://m.media-amazon.com/images/M/MV5BMWRiZGQ1NDMtODQ2OS00MDlhLWJkZGYtM2ZmNjlhZThjOWRmXkEyXkFqcGdeQXVyMTkxNjUyNQ@@._V1_SX92_CR0,0,92,139_.jpg",https://imdb.com/title/tt6467266?ref_=mojo_rl_summary&rf=mojo_rl_summary
rl1759937281,Prey for the Devil,A nun prepares to perform an exorcism and comes face to face with a demonic force with mysterious ties to her past.,United States,English-Bulgarian-Spanish-Latin,Warner Bros.See full company information,"Oct 28, 2022",PG-13,1 hr 33 min,Horror-Mystery-Thriller,5.3,18000,2671,0,398560,19802293,44658929,"https://m.media-amazon.com/images/M/MV5BNzNjNmE4YTktMTZiNS00YTQ0LWExY2YtZTU2MGNiNzBiMzI5XkEyXkFqcGdeQXVyMTA0OTI1NDM2._V1_SY139_CR1,0,92,139_.jpg",https://imdb.com/title/tt9271672?ref_=mojo_rl_summary&rf=mojo_rl_summary
rl1748599553,The Bad Guys,"To avoid prison, a gang of notorious animal criminals pretends to seek being rehabilitated, only for their leader to realize that he genuinely wants to change his ways.",United States-United Kingdom,English-Spanish,CGV Mars DagitimSee full company information,"Mar 25, 2022",PG,1 hr 40 min,Adventure-Animation-Comedy-Crime-Family,6.8,59000,1637,0,375163,97459240,250387888,"https://m.media-amazon.com/images/M/MV5BMDhkYmU0MzctMWEzNy00ODg1LWI3ZjAtMGZlZjkzNWVmMzVjXkEyXkFqcGdeQXVyMTM1MTE1NDMx._V1_SX92_CR0,0,92,139_.jpg",https://imdb.com/title/tt8115900?ref_=mojo_rl_summary&rf=mojo_rl_summary
rl1143964417,Death on the Nile,"While on vacation on the Nile, Hercule Poirot must investigate the murder of a young heiress.",United States-United Kingdom,English-French-German,Universal PicturesSee full company information,"Feb 11, 2022",PG-13,2 hr 7 min,Crime-Drama-Mystery,6.3,189000,924,0,351735,45630104,137307235,"https://m.media-amazon.com/images/M/MV5BNjI4ZTQ1OTYtNTI0Yi00M2EyLThiNjMtMzk1MmZlOWMyMDQwXkEyXkFqcGdeQXVyMTEyMjM2NDc2._V1_SY139_CR1,0,92,139_.jpg",https://imdb.com/title/tt7657566?ref_=mojo_rl_summary&rf=mojo_rl_summary
rl1865908993,Wrath of Man,A cold and mysterious character working at a cash truck company responsible for moving a lot of money around Los Angeles each week.,United Kingdom-United States,English-Spanish-Arabic,CJ EntertainmentSee full company information,"Mar 11, 2022",R,1 hr 59 min,Action-Crime-Thriller,7.1,208000,1936,0,349085,27466489,103966489,"https://m.media-amazon.com/images/M/MV5BNGVkOTlhOTktNjZiNS00NDg3LWIxMDAtZTY5Y2E0YjllN2IxXkEyXkFqcGdeQXVyMTkxNjUyNQ@@._V1_SY139_CR1,0,92,139_.jpg",https://imdb.com/title/tt11083552?ref_=mojo_rl_summary&rf=mojo_rl_summary
rl200442625,Jailangkung: Sandekala,"The supernatural terror centers on a small family consisting of Adrian and his wife Sandra, along with their two children, Niki and Kinan, who are on vacation out of town.",Indonesia-South Korea,Indonesian,CJ EntertainmentSee full company information,"Dec 9, 2022",Not Supplied,1 hr 32 min,Horror,5.7,295,3213,0,343774,0,343774,"https://m.media-amazon.com/images/M/MV5BNWUwYzc4YjYtNTQyNi00NDcxLTlhNDAtYWRkODgwYzcyYzYwXkEyXkFqcGdeQXVyMTEzMTI1Mjk3._V1_SY139_CR9,0,92,139_.jpg",https://imdb.com/title/tt21600496?ref_=mojo_rl_summary&rf=mojo_rl_summary
rl2445509377,Urban Myths,"Deals with the vivid everyday life horrors that can be easily encountered in familiar places around subjects like noise between floors, secondhand furniture, mannequins, and social media.",South Korea,Korean,Lotte EntertainmentSee full company information,"Dec 5, 2022",Not Supplied,2 hr 3 min,Horror-Mystery-Thriller,5,292,2050,0,359402,0,1201324,"https://m.media-amazon.com/images/M/MV5BOWRiN2FkOTUtYmVjMi00NmQ3LWE0NzMtODQ4ZGY4YjBjYTdhXkEyXkFqcGdeQXVyMzYxOTQ3MDg@._V1_SY139_CR0,0,92,139_.jpg",https://imdb.com/title/tt20039176?ref_=mojo_rl_summary&rf=mojo_rl_summary
rl2888073985,Spider-Man: No Way Home,"With Spider-Man's identity now revealed, Peter asks Doctor Strange for help. When a spell goes wrong, dangerous foes from other worlds start to appear, forcing Peter to discover what it truly means to be Spider-Man.",United States,English,Galaxy Distribution,"Dec 17, 2021",PG-13,2 hr 28 min,Action-Adventure-Fantasy-Sci-Fi,8.2,881000,5463,0,4375144,804793477,1912233593,"https://m.media-amazon.com/images/M/MV5BZWMyYzFjYTYtNTRjYi00OGExLWE2YzgtOGRmYjAxZTU3NzBiXkEyXkFqcGdeQXVyMzQ0MzA0NTM@._V1_SY139_CR1,0,92,139_.jpg",https://imdb.com/title/tt10872600?ref_=mojo_rl_summary&rf=mojo_rl_summary
rl1104315137,Alienoid,The door of time opens between the swordsman who wants to seize the legendary divine sword at the end of the Goryeo Dynasty and those who chase after an alien prisoner imprisoned in a human body in 2022.,South Korea,Korean,Warner Bros.See full company information,"Aug 5, 2022",Not Supplied,2 hr 22 min,Action-Adventure-Fantasy-Sci-Fi,6.2,5300,2089,0,348749,168309,12067556,"https://m.media-amazon.com/images/M/MV5BNWJiMmRkNTQtNjhjOC00NmJkLWJlODgtZGM4NTE4YzRkNGJjXkEyXkFqcGdeQXVyODc5Mjc4Nzg@._V1_SY139_CR2,0,92,139_.jpg",https://imdb.com/title/tt20168564?ref_=mojo_rl_summary&rf=mojo_rl_summary
rl4024468225,Muoi: The Curse Returns,"Linh accepts the invitation to visit Hang, her long lost best friend at a old house in a nearby city. During her stay, Linh discovers the haunted portrait of Muoi and its curse throughout years of anger. Linh has to make a life and death decision of either running away or facing the curse in order to save her friend. Little does she know, while slowly unfolding the darkest secret behind this haunted portrait, Linh is falling deeper into the most horrific trap, which was contrived... specifically, just for her.",Vietnam,Vietnamese,CGV Mars DagitimSee full company information,"Sep 30, 2022",Not Supplied,1 hr 35 min,Drama-Horror,4.6,149,2110,0,979140,0,984397,"https://m.media-amazon.com/images/M/MV5BYmJiY2FmMjctYWI4ZS00NWRmLWFjYjYtMDg1OTE1NzhiZDdmXkEyXkFqcGdeQXVyMTUxNjA3Nzk5._V1_SY139_CR9,0,92,139_.jpg",https://imdb.com/title/tt21210720?ref_=mojo_rl_summary&rf=mojo_rl_summary
rl1272349441,Nope,The residents of a lonely gulch in inland California bear witness to an uncanny and chilling discovery.,Canada-Japan-United States,English-Spanish,Warner Bros.See full company information,"Aug 26, 2022",R,2 hr 10 min,Horror-Mystery-Sci-Fi-Thriller,6.8,267000,2448,0,319624,123277080,171235592,"https://m.media-amazon.com/images/M/MV5BMGIyNTI3NWItNTJkOS00MGYyLWE4NjgtZDhjMWQ4Y2JkZTU5XkEyXkFqcGdeQXVyNjY1MTg4Mzc@._V1_SX92_CR0,0,92,139_.jpg",https://imdb.com/title/tt10954984?ref_=mojo_rl_summary&rf=mojo_rl_summary
rl1966703361,Men Gai Mien Tay,,Vietnam,Vietnamese,Universal PicturesSee full company information,"Mar 25, 2022",Not Supplied,1 hr 43 min,Comedy-Drama,6.9,9,1418,0,317976,0,317976,"https://m.media-amazon.com/images/M/MV5BNzc3M2FiYTctM2Q3NS00MzZlLWFlODgtNDk5MDgyNzY2NTc2XkEyXkFqcGdeQXVyNDc0Njc1NTY@._V1_SY139_CR1,0,92,139_.jpg",https://imdb.com/title/tt19116796?ref_=mojo_rl_summary&rf=mojo_rl_summary
rl1776714497,"Lyle, Lyle, Crocodile",Feature film based on the children's book about a crocodile that lives in New York City.,United States-United Kingdom,English,Galaxy Studio,"Oct 28, 2022",PG,1 hr 46 min,Adventure-Comedy-Family-Fantasy-Musical,6.1,15000,1423,0,310491,46888441,110999085,"https://m.media-amazon.com/images/M/MV5BYjNhZjA3MTctOTFjNi00Mjg5LTk3ODctOGZkNDMyMjY3YWNhXkEyXkFqcGdeQXVyMTI2ODM1ODUw._V1_SY139_CR1,0,92,139_.jpg",https://imdb.com/title/tt14668630?ref_=mojo_rl_summary&rf=mojo_rl_summary
rl3610477313,Ex,The story of how social networks and instant messengers are changing the life of a modern person.,Russia,Russian,Galaxy Studio,"Feb 25, 2022",Not Supplied,1 hr 27 min,Drama-Horror-Mystery-Thriller,4.4,312,1965,0,298884,0,344631,"https://m.media-amazon.com/images/M/MV5BODAzZWY4YmYtMTkzNS00NzZmLTlmNDItMWY5ZDMzM2ZiZmNjXkEyXkFqcGdeQXVyNDM1ODc2NzE@._V1_SY139_CR2,0,92,139_.jpg",https://imdb.com/title/tt14253440?ref_=mojo_rl_summary&rf=mojo_rl_summary
rl1765376769,The Lost City,A reclusive romance novelist on a book tour with her cover model gets swept up in a kidnapping attempt that lands them both in a cutthroat jungle adventure.,United States,English-Spanish-Latin,CGV Mars DagitimSee full company information,"Mar 25, 2022",PG-13,1 hr 52 min,Action-Adventure-Comedy-Romance,6.1,159000,2313,0,343425,105344029,192907684,"https://m.media-amazon.com/images/M/MV5BMmIwYzFhODAtY2I1YS00ZDdmLTkyYWQtZjI5NDIwMDc2MjEyXkEyXkFqcGdeQXVyODk4OTc3MTY@._V1_SY139_CR1,0,92,139_.jpg",https://imdb.com/title/tt13320622?ref_=mojo_rl_summary&rf=mojo_rl_summary
rl2061009665,Ivanna,"Ambar and his family were terrorized when they celebrated Lebaran in the Bandung area. Ambar, a beautiful young woman who has limited vision, is able to see things that other people can't see.",Indonesia,Indonesian-Japanese-Dutch,Warner Bros.See full company information,"Sep 1, 2022",Not Supplied,1 hr 43 min,Horror-Mystery-Thriller,5.7,1200,1445,0,367453,0,367453,"https://m.media-amazon.com/images/M/MV5BYzc3NjZiNzctMzA1Zi00MWI5LTgxM2ItY2I1ZWFhZjFjZjAyXkEyXkFqcGdeQXVyMTM3MzAxODg0._V1_SY139_CR9,0,92,139_.jpg",https://imdb.com/title/tt11448138?ref_=mojo_rl_summary&rf=mojo_rl_summary
rl1808237313,Maika,"After a meteor falls to earth, 8-year-old Hung meets an alien girl from the planet Maika, searching for her lost friend. The alien helps Hung make new friends and heal a broken heart. But danger lurks everywhere.",Vietnam,Vietnamese,BHD CO. LTD.,"May 27, 2022",PG,1 hr 45 min,Adventure-Comedy-Family,6.1,110,1135,0,276867,69257,346124,"https://m.media-amazon.com/images/M/MV5BYTRiMDA0NzctMTcxMi00NWIxLWEwNTctNGNiYzU3OGRmZjQxXkEyXkFqcGdeQXVyNzA2MDk0MTk@._V1_SY139_CR10,0,92,139_.jpg",https://imdb.com/title/tt16378354?ref_=mojo_rl_summary&rf=mojo_rl_summary
rl3084354305,Dragon Ball Super: Super Hero,The Red Ribbon Army from Goku's past has returned with two new androids to challenge him and his friends.,Japan,English-Japanese,Galaxy Studio,"Aug 19, 2022",PG-13,1 hr 40 min,Action-Adventure-Animation-Fantasy,7.1,15000,2610,0,241788,38112140,86562140,"https://m.media-amazon.com/images/M/MV5BZmFjNzkwOGYtMzBlYS00NmI4LWIwOTAtMDhhMjY4ZDkwNzI0XkEyXkFqcGdeQXVyODUyNjMyOTE@._V1_SY139_CR1,0,92,139_.jpg",https://imdb.com/title/tt14614892?ref_=mojo_rl_summary&rf=mojo_rl_summary
rl3687482113,Kuntilanak 3,"Dinda, who is considered strange by the village children because of her strength, accidentally injures Panji and Ambar. She regrets and asks Aunt Donna to register her at the Mata Hati School, so that she can learn to control her power.",Indonesia,Indonesian,Galaxy Studio,"Jun 23, 2022",Not Supplied,1 hr 45 min,Adventure-Fantasy-Horror,4.3,264,1388,0,255403,0,255403,"https://m.media-amazon.com/images/M/MV5BM2Y2YWU5ZWQtYTA3NS00YzFiLTk5MmUtMmIxZDE4OWY1YjYxXkEyXkFqcGdeQXVyMTEzMTI1Mjk3._V1_SY139_CR0,0,92,139_.jpg",https://imdb.com/title/tt18750866?ref_=mojo_rl_summary&rf=mojo_rl_summary
rl3358819073,The Policeman's Lineage,Parasite's Woo-sik Choi stars as one of the two cops with different methods teaming up to investigate a case that turns the police force upside down.,South Korea,Korean,Lotte EntertainmentSee full company information,"Feb 25, 2022",Not Supplied,1 hr 59 min,Action-Crime-Drama-Thriller,6.1,897,1255,0,221564,0,5869939,"https://m.media-amazon.com/images/M/MV5BYTJlYjdiYTctOTg2NC00YzNhLTgwNTMtMDE1NWI2NjIwNDk3XkEyXkFqcGdeQXVyMTE4OTg5ODA2._V1_SY139_CR3,0,92,139_.jpg",https://imdb.com/title/tt16676718?ref_=mojo_rl_summary&rf=mojo_rl_summary
rl3033957121,The Invitation,"A young woman is courted and swept off her feet, only to realize a gothic conspiracy is afoot.",United States-Hungary,English,Galaxy Studio,"Aug 26, 2022",PG-13,1 hr 45 min,Horror-Thriller,5.3,32000,1755,0,218991,25100080,38036130,"https://m.media-amazon.com/images/M/MV5BYTk3YWEwOTYtYTFiOS00NjJiLWJiOTAtMTRkZDY1Y2M1MDIyXkEyXkFqcGdeQXVyMTA3MDk2NDg2._V1_SY139_CR0,0,92,139_.jpg",https://imdb.com/title/tt12873562?ref_=mojo_rl_summary&rf=mojo_rl_summary
rl1391231745,The Menu,"A young couple travels to a remote island to eat at an exclusive restaurant where the chef has prepared a lavish menu, with some shocking surprises.",United States,English-Spanish,Warner Bros.See full company information,"Nov 18, 2022",R,1 hr 47 min,Comedy-Horror-Thriller,7.2,393000,905,0,209457,38501125,79628200,"https://m.media-amazon.com/images/M/MV5BMzdjNjI5MmYtODhiNS00NTcyLWEzZmUtYzVmODM5YzExNDE3XkEyXkFqcGdeQXVyMTAyMjQ3NzQ1._V1_SY139_CR0,0,92,139_.jpg",https://imdb.com/title/tt9764362?ref_=mojo_rl_summary&rf=mojo_rl_summary
rl3017245441,Contorted,"A family moves to a quiet and isolated place, but suffers from nightmares on their very first day in the new home. The wife is anxious about a strange sound she hears in the warehouse, but her husband ignores her concern. Meanwhile, the family's nightmares are getting worse, to the point that they can hardly tell the difference between dream and reality.",South Korea,Korean,Warner Bros.See full company information,"Aug 19, 2022",Not Supplied,1 hr 31 min,Horror-Mystery,4.6,165,1807,0,208758,0,462593,"https://m.media-amazon.com/images/M/MV5BYTFjMTY2OGUtMGViYS00OThjLTg0NzctYmQ5ZTcxYWNhY2ZlXkEyXkFqcGdeQXVyMTA5NzUzODM4._V1_SY139_CR3,0,92,139_.jpg",https://imdb.com/title/tt21263500?ref_=mojo_rl_summary&rf=mojo_rl_summary
rl875660033,House of Gucci,"When Patrizia Reggiani, an outsider from humble beginnings, marries into the Gucci family, her unbridled ambition begins to unravel their legacy and triggers a reckless spiral of betrayal, decadence, revenge, and ultimately...murder.",United States-Canada-United Kingdom,English-Italian-Arabic-Spanish-Japanese-French,Universal PicturesSee full company information,"Feb 18, 2022",R,2 hr 38 min,Biography-Crime-Drama,6.6,160000,829,0,220506,53809574,153269161,"https://m.media-amazon.com/images/M/MV5BYzdlMTMyZWQtZWNmMC00MTJiLWIyMWMtM2ZlZDdlYzZhNTc0XkEyXkFqcGdeQXVyMTMzNDE5NDM2._V1_SY139_CR1,0,92,139_.jpg",https://imdb.com/title/tt11214590?ref_=mojo_rl_summary&rf=mojo_rl_summary
rl4075848449,Violent Night,"An elite team of mercenaries breaks into a family compound on Christmas Eve, taking everyone hostage. However, they aren't prepared for a surprise combatant: Santa Claus is on the grounds, and he's about to show why this Nick is no saint.",United States-Canada-Japan,English,Warner Bros.See full company information,"Dec 2, 2022",R,1 hr 52 min,Action-Comedy-Thriller,6.7,99000,730,0,245296,50057405,76004405,"https://m.media-amazon.com/images/M/MV5BYzg2NWNhOWItYjA3Yi00MzhhLTg4ZmItYzM3ZTIwN2U0ZGQ5XkEyXkFqcGdeQXVyMzEyMDQzNzY@._V1_SY139_CR9,0,92,139_.jpg",https://imdb.com/title/tt12003946?ref_=mojo_rl_summary&rf=mojo_rl_summary
rl299074305,Haunted Universities 2nd Semester,"Every campus has its own horror tales. There's an endless supply of ghost stories passed down from class to class, and three of the scariest tales will be told this time: The ""C"" Bed, The Final Year's Cheer and The Old Science Building.",Thailand,Thai,Galaxy Studio,"Jul 29, 2022",Not Supplied,2 hr 10 min,Comedy-Horror-Thriller,4.7,211,1529,0,248736,0,248736,"https://m.media-amazon.com/images/M/MV5BZjQ5ZDM3MjYtODgxMy00NTZhLWJiMTYtNTk5ZmNmMTdmMzk5XkEyXkFqcGdeQXVyMTA5NzUzODM4._V1_SY139_CR2,0,92,139_.jpg",https://imdb.com/title/tt19328882?ref_=mojo_rl_summary&rf=mojo_rl_summary
rl3017179905,The Nightmares,"Constantly dreaming of being killed by a faceless killer every night, Phuong Anh's life is disturbed. However, even more horrifying happens, when the Faceless Killer comes into life and pursues her.",Vietnam,Vietnamese,Warner Bros.See full company information,"Aug 26, 2022",Not Supplied,1 hr 27 min,Horror,4.5,39,2543,0,202654,0,202654,"https://m.media-amazon.com/images/M/MV5BNmQzYTc4M2QtMzE3MC00ZmVjLTlmOTQtYmI2M2M1OGIyMTliXkEyXkFqcGdeQXVyNjU0NTI0Nw@@._V1_SY139_CR0,0,92,139_.jpg",https://imdb.com/title/tt16118610?ref_=mojo_rl_summary&rf=mojo_rl_summary
rl3956179713,Decision to Leave,A detective investigating a man's death in the mountains meets the dead man's mysterious wife in the course of his dogged sleuthing.,South Korea,Korean-Mandarin-English,Warner Bros.See full company information,"Jul 14, 2022",Not Supplied,2 hr 19 min,Crime-Drama-Mystery-Romance-Thriller,7.3,55000,917,0,209213,2179864,22581906,"https://m.media-amazon.com/images/M/MV5BOTEzYTljMTMtODU0ZC00ZWI0LTlhOGEtYjE3MjI3NTI1YmNhXkEyXkFqcGdeQXVyNjgxODk1MTM@._V1_SY139_CR1,0,92,139_.jpg",https://imdb.com/title/tt12477480?ref_=mojo_rl_summary&rf=mojo_rl_summary
rl3704259329,Broker,"When a young mother reconsiders abandoning her baby, she discovers a scheme selling foundlings for adoption.",South Korea,Korean,Warner Bros.See full company information,"Jun 23, 2022",R,2 hr 9 min,Comedy-Crime-Drama,7.1,17000,1459,0,214547,1046899,18851416,"https://m.media-amazon.com/images/M/MV5BY2UxOTEwOGUtYmFmOS00NTc4LWI0MWMtNGJkZGViY2EwZTgyXkEyXkFqcGdeQXVyNDY5NTQyMDU@._V1_SY139_CR2,0,92,139_.jpg",https://imdb.com/title/tt13056052?ref_=mojo_rl_summary&rf=mojo_rl_summary
